### ISSUE TITLE
This system already has IPv4 connectivity; no need for a CLAT

### ISSUE THREAD

**Issue by tryeverything91** [toreanderson/clatd#21]
Hi,
i tried to setup it but it seems not working
clatd says system already has ipv4 but its not
i didn't set any manual configuration.(there is no /etc/clatd.conf)
its an ipv6-only openvz vps with debian 11

```
root@debia1:~# clatd -d
Configuration successfully read, dumping it:
  clat-dev=clat
  clat-v4-addr=192.0.0.1
  clat-v6-addr=<undefined>
  cmd-ip=ip
  cmd-ip6tables=ip6tables
  cmd-tayga=tayga
  debug=1
  dns64-servers=<undefined>
  forwarding-enable=1
  ip6tables-enable=<undefined>
  plat-dev=<undefined>
  plat-prefix=<undefined>
  proxynd-enable=1
  quiet=0
  script-down=<undefined>
  script-up=<undefined>
  tayga-conffile=<undefined>
  tayga-v4-addr=192.0.0.2
  v4-conncheck-delay=10
  v4-conncheck-enable=1
  v4-defaultroute-advmss=0
  v4-defaultroute-enable=1
  v4-defaultroute-metric=2048
  v4-defaultroute-mtu=1260
  v4-defaultroute-replace=0
Starting clatd v1.5 by Tore Anderson <tore@fud.no>
Performing DNS64-based PLAT prefix discovery (cf. RFC 7050)
Looking up 'ipv4only.arpa' using system resolver
check_wka(): Testing to see if 2001:67c:2960:6464:0:0:c000:ab was DNS64-synthesised
Inferred PLAT prefix 2001:67c:2960:6464::/96 from AAAA record 2001:67c:2960:6464:0:0:c000:ab
check_wka(): Testing to see if 2001:67c:2960:6464:0:0:c000:aa was DNS64-synthesised
Inferred PLAT prefix 2001:67c:2960:6464::/96 from AAAA record 2001:67c:2960:6464:0:0:c000:aa
Using PLAT (NAT64) prefix: 2001:67c:2960:6464::/96
get_plat_dev(): finding which network dev faces the PLAT
get_plat_dev(): Found PLAT-facing device: venet0
Device facing the PLAT: venet0
Attempting to derive a CLAT IPv6 address from an IPv6 address on 'venet0'
Using CLAT IPv4 address: 192.0.0.1
Using CLAT IPv6 address: 2001:41d0:c:e70:1234:1234:5517:1dd4
Checking if this system already has IPv4 connectivity in 10 sec(s)
This system already has IPv4 connectivity; no need for a CLAT.
```
```
root@debia1:~# ifconfig 
clat: flags=4305<UP,POINTOPOINT,RUNNING,NOARP,MULTICAST>  mtu 1500
        inet 192.0.0.1  netmask 255.255.255.255  destination 192.0.0.1
        inet6 fe80::12fa:638c:2c1d:91ae  prefixlen 64  scopeid 0x20<link>
        unspec 00-00-00-00-00-00-00-00-00-00-00-00-00-00-00-00  txqueuelen 500  (UNSPEC)
        RX packets 5  bytes 400 (400.0 B)
        RX errors 0  dropped 0  overruns 0  frame 0
        TX packets 12  bytes 748 (748.0 B)
        TX errors 0  dropped 0 overruns 0  carrier 0  collisions 0

lo: flags=73<UP,LOOPBACK,RUNNING>  mtu 65536
        inet 127.0.0.1  netmask 255.0.0.0
        inet6 ::1  prefixlen 128  scopeid 0x10<host>
        loop  txqueuelen 1000  (Local Loopback)
        RX packets 130  bytes 7090 (6.9 KiB)
        RX errors 0  dropped 0  overruns 0  frame 0
        TX packets 130  bytes 7090 (6.9 KiB)
        TX errors 0  dropped 0 overruns 0  carrier 0  collisions 0

venet0: flags=211<UP,BROADCAST,POINTOPOINT,RUNNING,NOARP>  mtu 1500
        inet 127.0.0.1  netmask 255.255.255.255  broadcast 0.0.0.0  destination 127.0.0.1
        inet6 2001:41d0:c:e70:1234:1234:5517:1  prefixlen 112  scopeid 0x0<global>
        unspec 00-00-00-00-00-00-00-00-00-00-00-00-00-00-00-00  txqueuelen 0  (UNSPEC)
        RX packets 7597153  bytes 11249572457 (10.4 GiB)
        RX errors 0  dropped 0  overruns 0  frame 0
        TX packets 7578495  bytes 1157799430 (1.0 GiB)
        TX errors 0  dropped 7 overruns 0  carrier 0  collisions 0

venet0:0: flags=211<UP,BROADCAST,POINTOPOINT,RUNNING,NOARP>  mtu 1500
        inet 192.168.0.152  netmask 255.255.252.0  broadcast 192.168.3.255  destination 192.168.0.152
        unspec 00-00-00-00-00-00-00-00-00-00-00-00-00-00-00-00  txqueuelen 0  (UNSPEC)
```
```
root@debia1:~# ip address show dev venet0  
2: venet0: <BROADCAST,POINTOPOINT,NOARP,UP,LOWER_UP> mtu 1500 qdisc noqueue state UNKNOWN group default 
    link/void 
    inet 127.0.0.1/32 scope host venet0
       valid_lft forever preferred_lft forever
    inet 192.168.0.152/22 brd 192.168.3.255 scope global venet0:0
       valid_lft forever preferred_lft forever
    inet6 2001:41d0:c:e70:1234:1234:5517:1/112 scope global 
       valid_lft forever preferred_lft forever

root@debia1:~# ip addr
1: lo: <LOOPBACK,UP,LOWER_UP> mtu 65536 qdisc noqueue state UNKNOWN group default qlen 1000
    link/loopback 00:00:00:00:00:00 brd 00:00:00:00:00:00
    inet 127.0.0.1/8 scope host lo
       valid_lft forever preferred_lft forever
    inet6 ::1/128 scope host 
       valid_lft forever preferred_lft forever
2: venet0: <BROADCAST,POINTOPOINT,NOARP,UP,LOWER_UP> mtu 1500 qdisc noqueue state UNKNOWN group default 
    link/void 
    inet 127.0.0.1/32 scope host venet0
       valid_lft forever preferred_lft forever
    inet 192.168.0.152/22 brd 192.168.3.255 scope global venet0:0
       valid_lft forever preferred_lft forever
    inet6 2001:41d0:c:e70:1234:1234:5517:1/112 scope global 
       valid_lft forever preferred_lft forever


root@debia1:~# ip route
192.168.0.0/22 dev venet0 proto kernel scope link src 192.168.0.152 

root@debia1:~# ip -6 route
2001:41d0:c:e70:1234:1234:5517:0/112 dev venet0 proto kernel metric 256 pref medium
default dev venet0 metric 1024 pref medium
```

also dns64/nat64 is ok
```
root@debia1:~# curl myip.ipip.net
?? IP:45.63.43.39  ???:?? ???? ?????  choopa.com

root@debia1:~# ping6 github.com
PING github.com(lb-140-82-121-3-fra.github.com (2001:67c:2960:6464::8c52:7903)) 56 data bytes
64 bytes from lb-140-82-121-3-fra.github.com (2001:67c:2960:6464::8c52:7903): icmp_seq=1 ttl=37 time=13.3 ms
^C
--- github.com ping statistics ---
1 packets transmitted, 1 received, 0% packet loss, time 0ms
rtt min/avg/max/mdev = 13.337/13.337/13.337/0.000 ms
root@debia1:~# 
```
Thanks

**Comment by toreanderson** [comment]
Can you check the output of `ip -4 route list default`? That's what `clatd` does when it checks for pre-existing IPv4 connectivity.

**Comment by tryeverything91** [comment]
when clatd service is stopped, there is no out put
```
root@debia1:~# ip -4 route list default
root@debia1:~# 
```
after running clatd, the output is:
```
root@debia1:~# ip -4 route list default
default dev clat scope link metric 2048 mtu 1260 advmss 1220 
```

**Comment by tryeverything91** [comment]
> Can you check the output of `ip -4 route list default`? That's what `clatd` does when it checks for pre-existing IPv4 connectivity.

when clatd service is stopped, there is no out put
```
root@debia1:~# ip -4 route list default
root@debia1:~# 
```
after running clatd, the output is:
```
root@debia1:~# ip -4 route list default
default dev clat scope link metric 2048 mtu 1260 advmss 1220 
```

**Comment by toreanderson** [comment]
I'm confused. In your initial report, you include output that shows clatd failing to start (due to a pre-existing IPv4 default route being detected). However, your last comment shows the status when clatd is running (it has installed an IPv4 default route, at least). What is the problem here, exactly?

**Comment by tryeverything91** [comment]
the problem is that now when i run 
curl -4 google.com
I don't receive any response
Should i send you output of anything ?

**Comment by tryeverything91** [comment]
I suspect to vnet0:0 interface
```
venet0:0: flags=211<UP,BROADCAST,POINTOPOINT,RUNNING,NOARP>  mtu 1500
        inet 192.168.0.152  netmask 255.255.252.0  broadcast 192.168.3.255  destination 192.168.0.152
        unspec 00-00-00-00-00-00-00-00-00-00-00-00-00-00-00-00  txqueuelen 0  (UNSPEC)
```
These links may be related to my problem

https://askubuntu.com/questions/611284/referanceing-venet00-and-venet01-in-iptables-on-openvz

https://serverfault.com/questions/422204/secondary-ip-eth00-acts-like-main-server-ip

**Comment by toreanderson** [comment]
So to me it seems like you are able to make clatd start up correctly, and that the title of this bug report and the debug output you posted initially is not really relevant? I suspect you might have attempted to start a second instance of clatd while another was already running, that would explain the «this system already has IPv4 connectivity, no need for a CLAT» message, at least.

What I would like you to do, is to start clatd in full debug mode, dump the network traffic while sending some test pings. In four different terminals, start the following commands (in order):

1. `clatd -d -d |& tee clatd.log`
2. `tcpdump -ni clat icmp or icmp6 |& tee tcpdump_clat.log`
3. `tcpdump -ni venet0 icmp or icmp6 |& tee tcpdump_venet0.log`
4. `ping -c 10 1.1.1.1 |& tee ping.log`

When the ping command has finished, you can stop the other commands (press `CTRL+C`), and send me the attached `*.log` files.

**Comment by tryeverything91** [comment]
i rebooted my vps

**Comment by tryeverything91** [comment]
i rebooted my vps then tried to run 1st command and it said there is no tcpdump: clatd: device. then i had to start its sevice mannully

**Comment by tryeverything91** [comment]
i believe something wrong. is this normal that i should manually start clatd servie ?

**Comment by tryeverything91** [comment]
Hello, I apologize for the delay in replying
i wanted to send you everything like you said
i started to do but the clatd interface won't create anymore
everything is same as my first message and still it shows "the system already have ... no need for clat", but when i run ifconfig i don't see clatd interface
btw I'll send you log files and also I'm working on it by reinstalling clatd to fix this new issue.
i had one problem and now i have two :)

**Comment by tryeverything91** [comment]
> * `clatd -d -d |& tee clatd.log`
> * `tcpdump -ni clat icmp or icmp6 |& tee tcpdump_clat.log`
> * `tcpdump -ni venet0 icmp or icmp6 |& tee tcpdump_venet0.log`
> * `ping -c 10 1.1.1.1 |& tee ping.log`

[clatd.log](https://github.com/toreanderson/clatd/files/10329540/clatd.log)
[tcpdump_clat.log](https://github.com/toreanderson/clatd/files/10329542/tcpdump_clat.log)
[tcpdump_venet0.log](https://github.com/toreanderson/clatd/files/10329543/tcpdump_venet0.log)
[ping.log](https://github.com/toreanderson/clatd/files/10329545/ping.log)

And again I have to remind you that according to what I see everything about dns64/nat64 is correct
```
root@debia1:~# curl ifconfig.me && echo -ne '\n'
195.140.194.178

root@debia1:~# ping6 github.com
PING github.com(lb-140-82-121-4-fra.github.com (2001:67c:2b0:db32:0:1:8c52:7904)) 56 data bytes
64 bytes from lb-140-82-121-4-fra.github.com (2001:67c:2b0:db32:0:1:8c52:7904): icmp_seq=1 ttl=44 time=57.8 ms
64 bytes from lb-140-82-121-4-fra.github.com (2001:67c:2b0:db32:0:1:8c52:7904): icmp_seq=2 ttl=44 time=70.3 ms
64 bytes from lb-140-82-121-4-fra.github.com (2001:67c:2b0:db32:0:1:8c52:7904): icmp_seq=3 ttl=44 time=296 ms
^C
--- github.com ping statistics ---
3 packets transmitted, 3 received, 0% packet loss, time 2002ms
rtt min/avg/max/mdev = 57.803/141.487/296.392/109.652 ms

root@debia1:~# cat /etc/resolv.conf
nameserver 2001:67c:2b0::4
nameserver 2001:67c:2b0::6

```

**Comment by toreanderson** [comment]
From your logs, it appears that the `clat` network device exists and probably has a default route attached to it (otherwise, you would not get the `This system already has IPv4 connectivity; no need for a CLAT.` message.

Therefore it would appear that you are sending me a log from a failed attempt to start a second and redundant instance of `clatd`. That log is useless to me, I would need to see the log from the actually running instance (there can be only one).

Please make sure that there is no running instance of `clatd`, and that the `clat` interface does not exist, and try again.

**Comment by tryeverything91** [comment]
```
root@debia1:~# cat clatd.co
cat: clatd.co: No such file or directory
root@1263100019woiden:~# cat clatd.log 
Configuration successfully read, dumping it:
  clat-dev=clat
  clat-v4-addr=192.0.0.1
  clat-v6-addr=<undefined>
  cmd-ip=ip
  cmd-ip6tables=ip6tables
  cmd-tayga=tayga
  debug=2
  dns64-servers=<undefined>
  forwarding-enable=1
  ip6tables-enable=<undefined>
  plat-dev=<undefined>
  plat-prefix=<undefined>
  proxynd-enable=1
  quiet=0
  script-down=<undefined>
  script-up=<undefined>
  tayga-conffile=<undefined>
  tayga-v4-addr=192.0.0.2
  v4-conncheck-delay=10
  v4-conncheck-enable=1
  v4-defaultroute-advmss=0
  v4-defaultroute-enable=1
  v4-defaultroute-metric=2048
  v4-defaultroute-mtu=1260
  v4-defaultroute-replace=0
Starting clatd v1.5 by Tore Anderson <tore@fud.no>
Performing DNS64-based PLAT prefix discovery (cf. RFC 7050)
cfg(dns64-servers)
Looking up 'ipv4only.arpa' using system resolver
check_wka(): Testing to see if 2001:67c:2b0:db32:0:1:c000:aa was DNS64-synthesised
Looking for Well-Known Addresses at prefix length /96
Looking for WKA ::c000:aa
Found it!
Inferred PLAT prefix 2001:67c:2b0:db32:0:1::/96 from AAAA record 2001:67c:2b0:db32:0:1:c000:aa
check_wka(): Testing to see if 2001:67c:2b0:db32:0:1:c000:ab was DNS64-synthesised
Looking for Well-Known Addresses at prefix length /96
Looking for WKA ::c000:aa
Didn't find it
Looking for WKA ::c000:ab
Found it!
Inferred PLAT prefix 2001:67c:2b0:db32:0:1::/96 from AAAA record 2001:67c:2b0:db32:0:1:c000:ab
Using PLAT (NAT64) prefix: 2001:67c:2b0:db32:0:1::/96
get_plat_dev(): finding which network dev faces the PLAT
cfg(plat-prefix)
cfg(cmd-ip)
get_plat_dev(): Found PLAT-facing device: venet0
Device facing the PLAT: venet0
cfg(plat-dev)
cfg(plat-prefix)
Attempting to derive a CLAT IPv6 address from an IPv6 address on 'venet0'
cfg(cmd-ip)
Saw a candidate address on 'venet0': 2a01:4f8:241:1f64:1111:1111:7c1b:1/112
Preferring 2a01:4f8:241:1f64:1111:1111:7c1b:1/112; best match so far
Using random interface ID: e344
Using CLAT IPv4 address: 192.0.0.1
Using CLAT IPv6 address: 2a01:4f8:241:1f64:1111:1111:7c1b:e344
cfgint(v4-defaultroute-mtu)
cfgbool(v4-conncheck-enable)
cfgbool(v4-defaultroute-replace)
cfgint(v4-conncheck-delay)
Checking if this system already has IPv4 connectivity in 10 sec(s)
cfg(cmd-ip)
cfg(tayga-conffile)
Using temporary conffile for TAYGA: /tmp/P9h3FiZvT4
cfg(clat-dev)
cfg(plat-prefix)
cfg(tayga-v4-addr)
cfg(clat-v4-addr)
cfg(clat-v6-addr)
cfgbool(forwarding-enable)
Reading sysctl /proc/sys/net/ipv6/conf/all/forwarding
/proc/sys/net/ipv6/conf/all/forwarding is set to '0'
Enabling IPv6 forwarding
Reading sysctl /proc/sys/net/ipv6/conf/default/accept_ra
/proc/sys/net/ipv6/conf/default/accept_ra is set to '1'
Changing /proc/sys/net/ipv6/conf/default/accept_ra from 1 to 2 to prevent connectivity loss after enabling IPv6 forwarding
Setting sysctl /proc/sys/net/ipv6/conf/default/accept_ra=2
Reading sysctl /proc/sys/net/ipv6/conf/lo/accept_ra
/proc/sys/net/ipv6/conf/lo/accept_ra is set to '1'
Changing /proc/sys/net/ipv6/conf/lo/accept_ra from 1 to 2 to prevent connectivity loss after enabling IPv6 forwarding
Setting sysctl /proc/sys/net/ipv6/conf/lo/accept_ra=2
Reading sysctl /proc/sys/net/ipv6/conf/venet0/accept_ra
/proc/sys/net/ipv6/conf/venet0/accept_ra is set to '1'
Changing /proc/sys/net/ipv6/conf/venet0/accept_ra from 1 to 2 to prevent connectivity loss after enabling IPv6 forwarding
Setting sysctl /proc/sys/net/ipv6/conf/venet0/accept_ra=2
Setting sysctl /proc/sys/net/ipv6/conf/all/forwarding=1
cfgbool(ip6tables-enable)
Adding ip6tables rules allowing traffic between the CLAT and PLAT devices
cfg(cmd-ip6tables)
cfg(clat-dev)
cfg(plat-dev)
cmd(ip6tables -I FORWARD -i clat -o venet0 -j ACCEPT)
cfg(cmd-ip6tables)
cfg(plat-dev)
cfg(clat-dev)
cmd(ip6tables -I FORWARD -i venet0 -o clat -j ACCEPT)
cfgbool(proxynd-enable)
cfg(plat-dev)
cfg(clat-v6-addr)
Enabling Proxy-ND for 2a01:4f8:241:1f64:1111:1111:7c1b:e344 on venet0
Reading sysctl /proc/sys/net/ipv6/conf/venet0/proxy_ndp
/proc/sys/net/ipv6/conf/venet0/proxy_ndp is set to '0'
Setting sysctl /proc/sys/net/ipv6/conf/venet0/proxy_ndp=1
Enabled Proxy-ND sysctl for venet0
cfg(cmd-ip)
cfg(clat-v6-addr)
cfg(plat-dev)
cmd(ip -6 neighbour add proxy 2a01:4f8:241:1f64:1111:1111:7c1b:e344 dev venet0)
cfg(clat-dev)
Creating and configuring up CLAT device 'clat'
cfg(cmd-tayga)
cfg(tayga-conffile)
cfgint(debug)
cmd(tayga --config /tmp/P9h3FiZvT4 --mktun -d)
Created persistent tun device clat
cfg(cmd-ip)
cfg(clat-dev)
cmd(ip link set up dev clat)
cfg(cmd-ip)
cfg(clat-v4-addr)
cfg(clat-dev)
cmd(ip -4 address add 192.0.0.1 dev clat)
cfg(cmd-ip)
cfg(clat-v6-addr)
cfg(clat-dev)
cmd(ip -6 route add 2a01:4f8:241:1f64:1111:1111:7c1b:e344 dev clat)
cfgbool(v4-defaultroute-replace)
cfgbool(v4-defaultroute-enable)
cfg(clat-dev)
cfgint(v4-defaultroute-metric)
cfgint(v4-defaultroute-metric)
cfgint(v4-defaultroute-mtu)
cfgint(v4-defaultroute-mtu)
cfgint(v4-defaultroute-advmss)
cfgint(v4-defaultroute-advmss)
Adding IPv4 default route via the CLAT
cfg(cmd-ip)
cmd(ip -4 route add default dev clat metric 2048 mtu 1260 advmss 1220)
Script env: clat-dev=clat
Script env: clat-v4-addr=192.0.0.1
Script env: clat-v6-addr=2a01:4f8:241:1f64:1111:1111:7c1b:e344
Script env: cmd-ip=ip
Script env: cmd-ip6tables=ip6tables
Script env: cmd-tayga=tayga
Script env: debug=2
Script env: dns64-servers=
Script env: forwarding-enable=1
Script env: ip6tables-enable=1
Script env: plat-dev=venet0
Script env: plat-prefix=2001:67c:2b0:db32:0:1::/96
Script env: proxynd-enable=1
Script env: quiet=
Script env: script-down=
Script env: script-up=
Script env: tayga-conffile=/tmp/P9h3FiZvT4
Script env: tayga-v4-addr=192.0.0.2
Script env: v4-conncheck-delay=10
Script env: v4-conncheck-enable=1
Script env: v4-defaultroute-advmss=1220
Script env: v4-defaultroute-enable=1
Script env: v4-defaultroute-metric=2048
Script env: v4-defaultroute-mtu=1260
Script env: v4-defaultroute-replace=
cfg(script-up)
Starting up TAYGA, using config file '/tmp/P9h3FiZvT4'
cfg(cmd-tayga)
cfg(tayga-conffile)
cfgint(debug)
cmd(tayga --config /tmp/P9h3FiZvT4 --nodetach -d)

```

maybe this is what you want. i stopped clatd service then ran it again.
command will not finished and freeze on "cmd(tayga --config /tmp/P9h3FiZvT4 --nodetach -d)"

**Comment by tryeverything91** [comment]
```
root@debia1:~# rm -r /tmp/
root@debia1:~# clatd -d -d |& tee clatd.log
Configuration successfully read, dumping it:
  clat-dev=clat
  clat-v4-addr=192.0.0.1
  clat-v6-addr=<undefined>
  cmd-ip=ip
  cmd-ip6tables=ip6tables
  cmd-tayga=tayga
  debug=2
  dns64-servers=<undefined>
  forwarding-enable=1
  ip6tables-enable=<undefined>
  plat-dev=<undefined>
  plat-prefix=<undefined>
  proxynd-enable=1
  quiet=0
  script-down=<undefined>
  script-up=<undefined>
  tayga-conffile=<undefined>
  tayga-v4-addr=192.0.0.2
  v4-conncheck-delay=10
  v4-conncheck-enable=1
  v4-defaultroute-advmss=0
  v4-defaultroute-enable=1
  v4-defaultroute-metric=2048
  v4-defaultroute-mtu=1260
  v4-defaultroute-replace=0
Starting clatd v1.5 by Tore Anderson <tore@fud.no>
Performing DNS64-based PLAT prefix discovery (cf. RFC 7050)
cfg(dns64-servers)
Looking up 'ipv4only.arpa' using system resolver
check_wka(): Testing to see if 2001:67c:2b0:db32:0:1:c000:aa was DNS64-synthesised
Looking for Well-Known Addresses at prefix length /96
Looking for WKA ::c000:aa
Found it!
Inferred PLAT prefix 2001:67c:2b0:db32:0:1::/96 from AAAA record 2001:67c:2b0:db32:0:1:c000:aa
check_wka(): Testing to see if 2001:67c:2b0:db32:0:1:c000:ab was DNS64-synthesised
Looking for Well-Known Addresses at prefix length /96
Looking for WKA ::c000:aa
Didn't find it
Looking for WKA ::c000:ab
Found it!
Inferred PLAT prefix 2001:67c:2b0:db32:0:1::/96 from AAAA record 2001:67c:2b0:db32:0:1:c000:ab
Using PLAT (NAT64) prefix: 2001:67c:2b0:db32:0:1::/96
get_plat_dev(): finding which network dev faces the PLAT
cfg(plat-prefix)
cfg(cmd-ip)
get_plat_dev(): Found PLAT-facing device: venet0
Device facing the PLAT: venet0
cfg(plat-dev)
cfg(plat-prefix)
Attempting to derive a CLAT IPv6 address from an IPv6 address on 'venet0'
cfg(cmd-ip)
Saw a candidate address on 'venet0': 2a01:4f8:241:1f64:1111:1111:7c1b:1/112
Preferring 2a01:4f8:241:1f64:1111:1111:7c1b:1/112; best match so far
Using random interface ID: 2a73
Using CLAT IPv4 address: 192.0.0.1
Using CLAT IPv6 address: 2a01:4f8:241:1f64:1111:1111:7c1b:2a73
cfgint(v4-defaultroute-mtu)
cfgbool(v4-conncheck-enable)
cfgbool(v4-defaultroute-replace)
cfgint(v4-conncheck-delay)
Checking if this system already has IPv4 connectivity in 10 sec(s)
cfg(cmd-ip)
This system already has IPv4 connectivity; no need for a CLAT.
```
i stopped it and ran it again . also i removed tmp files

**Comment by tryeverything91** [comment]
```
clat: flags=4241<UP,POINTOPOINT,NOARP,MULTICAST>  mtu 1500
        inet 192.0.0.1  netmask 255.255.255.255  destination 192.0.0.1
        inet6 fe80::88ec:d175:639a:20af  prefixlen 64  scopeid 0x20<link>
        unspec 00-00-00-00-00-00-00-00-00-00-00-00-00-00-00-00  txqueuelen 500  (UNSPEC)
        RX packets 2  bytes 160 (160.0 B)
        RX errors 0  dropped 0  overruns 0  frame 0
        TX packets 9  bytes 568 (568.0 B)
        TX errors 0  dropped 0 overruns 0  carrier 0  collisions 0

lo: flags=73<UP,LOOPBACK,RUNNING>  mtu 65536
        inet 127.0.0.1  netmask 255.0.0.0
        inet6 ::1  prefixlen 128  scopeid 0x10<host>
        loop  txqueuelen 1000  (Local Loopback)
        RX packets 13  bytes 709 (709.0 B)
        RX errors 0  dropped 0  overruns 0  frame 0
        TX packets 13  bytes 709 (709.0 B)
        TX errors 0  dropped 0 overruns 0  carrier 0  collisions 0

venet0: flags=211<UP,BROADCAST,POINTOPOINT,RUNNING,NOARP>  mtu 1500
        inet 127.0.0.1  netmask 255.255.255.255  broadcast 0.0.0.0  destination 127.0.0.1
        inet6 2a01:4f8:241:1f64:1111:1111:7c1b:1  prefixlen 112  scopeid 0x0<global>
        unspec 00-00-00-00-00-00-00-00-00-00-00-00-00-00-00-00  txqueuelen 0  (UNSPEC)
        RX packets 186052  bytes 261287972 (261.2 MB)
        RX errors 0  dropped 0  overruns 0  frame 0
        TX packets 73595  bytes 6559387 (6.5 MB)
        TX errors 0  dropped 46 overruns 0  carrier 0  collisions 0

venet0:0: flags=211<UP,BROADCAST,POINTOPOINT,RUNNING,NOARP>  mtu 1500
        inet 192.168.0.250  netmask 255.255.252.0  broadcast 192.168.3.255  destination 192.168.0.250
        unspec 00-00-00-00-00-00-00-00-00-00-00-00-00-00-00-00  txqueuelen 0  (UNSPEC)

```
i believe everything related to this venet0:0

**Comment by toreanderson** [comment]
The output you posted first looks normal, and it is expected that the clatd will "freeze" after `cmd(tayga --config /tmp/P9h3FiZvT4 --nodetach -d)`, that means it is running normally and will continue to do so until killed/interrupted.While it is running normally that, I need you to start the two tcpdump processes and do the ping test.

I don't see this `venet0:0` being mentioned in the clatd output, so I don't think that is relevant to be honest.

**Comment by tryeverything91** [comment]
Is there a way i send you dm ?
I will send you my vps ip:user:pass, so you can test what you want more quickly،
Thanks

**Comment by toreanderson** [comment]
You could send me an e-mail at tore@fud.no if you want (don't think GitHub has a concept of DMs).

**Comment by toreanderson** [comment]
Thank you for your e-mail. I have logged in and checked, and I believe the problem is caused by some firewall or VPS provider preventing your VPS from using a secondary address (the one assigned by clatd):

I can see that clatd is working correctly, by starting it in one terminal:

```
root@1263100019woiden:~# clatd
Starting clatd v1.5 by Tore Anderson <tore@fud.no>
Performing DNS64-based PLAT prefix discovery (cf. RFC 7050)
Using PLAT (NAT64) prefix: 2001:67c:2b0:db32:0:1::/96
Device facing the PLAT: venet0
Attempting to derive a CLAT IPv6 address from an IPv6 address on 'venet0'
Using CLAT IPv4 address: 192.0.0.1
Using CLAT IPv6 address: 2a01:4f8:241:1f64:1111:1111:7c1b:4499
Checking if this system already has IPv4 connectivity in 10 sec(s)
Adding ip6tables rules allowing traffic between the CLAT and PLAT devices
Enabling Proxy-ND for 2a01:4f8:241:1f64:1111:1111:7c1b:4499 on venet0
Creating and configuring up CLAT device 'clat'
Created persistent tun device clat
Adding IPv4 default route via the CLAT
Starting up TAYGA, using config file '/tmp/kCFEwTQcKC'
```

Note that clatd self-assigned itself the IPv6 address 2a01:4f8:241:1f64:1111:1111:7c1b:4499. This is a random address taken from the subnet assigned to venet0 (2a01:4f8:241:1f64:1111:1111:7c1b:0/112).

With clatd running, I can ping 1.1.1.1 and I see this traffic enter the `clat` interface as IPv4 and exit back out as IPv6`:

```
root@1263100019woiden:~# tcpdump -ni clat -c 6
tcpdump: verbose output suppressed, use -v or -vv for full protocol decode
listening on clat, link-type RAW (Raw IP), capture size 262144 bytes
14:06:55.656331 IP 192.0.0.1 > 1.1.1.1: ICMP echo request, id 15373, seq 28, length 64
14:06:55.656359 IP6 2a01:4f8:241:1f64:1111:1111:7c1b:4499 > 2001:67c:2b0:db32:0:1:101:101: ICMP6, echo request, seq 28, length 64
14:06:56.656304 IP 192.0.0.1 > 1.1.1.1: ICMP echo request, id 15373, seq 29, length 64
14:06:56.656334 IP6 2a01:4f8:241:1f64:1111:1111:7c1b:4499 > 2001:67c:2b0:db32:0:1:101:101: ICMP6, echo request, seq 29, length 64
14:06:57.656301 IP 192.0.0.1 > 1.1.1.1: ICMP echo request, id 15373, seq 30, length 64
14:06:57.656329 IP6 2a01:4f8:241:1f64:1111:1111:7c1b:4499 > 2001:67c:2b0:db32:0:1:101:101: ICMP6, echo request, seq 30, length 64
6 packets captured
8 packets received by filter
0 packets dropped by kernel
```

I can also see that the IPv6 packets are exiting venet0, however there are no responses:

```
root@1263100019woiden:~# tcpdump -ni venet0 icmp6 -c3
tcpdump: verbose output suppressed, use -v or -vv for full protocol decode
listening on venet0, link-type LINUX_SLL (Linux cooked v1), capture size 262144 bytes
14:07:33.656345 IP6 2a01:4f8:241:1f64:1111:1111:7c1b:4499 > 2001:67c:2b0:db32:0:1:101:101: ICMP6, echo request, seq 66, length 64
14:07:34.656361 IP6 2a01:4f8:241:1f64:1111:1111:7c1b:4499 > 2001:67c:2b0:db32:0:1:101:101: ICMP6, echo request, seq 67, length 64
14:07:35.656348 IP6 2a01:4f8:241:1f64:1111:1111:7c1b:4499 > 2001:67c:2b0:db32:0:1:101:101: ICMP6, echo request, seq 68, length 64
```

I can ping 2001:67c:2b0:db32:0:1:101:101 directly, however, using the primary address assigned to venet0 as the source. So network reachability through the NAT64 is not the issue.

To make it 100% certain that this issue is not caused by clatd, I can stop clatd, and instead assign that address directly to venet0 as a secondary address.

```
root@1263100019woiden:~# ip address add 2a01:4f8:241:1f64:1111:1111:7c1b:4499 preferred 0 dev venet0
root@1263100019woiden:~# ip -6 address show dev venet0
2: venet0: <BROADCAST,POINTOPOINT,NOARP,UP,LOWER_UP> mtu 1500 qdisc noqueue state UNKNOWN group default
    inet6 2a01:4f8:241:1f64:1111:1111:7c1b:4499/128 scope global deprecated
       valid_lft forever preferred_lft 0sec
    inet6 2a01:4f8:241:1f64:1111:1111:7c1b:1/112 scope global
       valid_lft forever preferred_lft forever
```

Now I can try to ping through the NAT64 using both the primary address (:1) and the secondary address (:4499), and the same problem occurs - only the primary address works:

```
root@1263100019woiden:~# ping -c 5 -I 2a01:4f8:241:1f64:1111:1111:7c1b:1 2001:67c:2b0:db32:0:1:101:101
PING 2001:67c:2b0:db32:0:1:101:101(2001:67c:2b0:db32:0:1:101:101) from 2a01:4f8:241:1f64:1111:1111:7c1b:1 : 56 data bytes
64 bytes from 2001:67c:2b0:db32:0:1:101:101: icmp_seq=1 ttl=51 time=771 ms
64 bytes from 2001:67c:2b0:db32:0:1:101:101: icmp_seq=2 ttl=51 time=1027 ms
64 bytes from 2001:67c:2b0:db32:0:1:101:101: icmp_seq=3 ttl=51 time=1150 ms
64 bytes from 2001:67c:2b0:db32:0:1:101:101: icmp_seq=4 ttl=51 time=1193 ms
64 bytes from 2001:67c:2b0:db32:0:1:101:101: icmp_seq=5 ttl=51 time=876 ms

--- 2001:67c:2b0:db32:0:1:101:101 ping statistics ---
5 packets transmitted, 5 received, 0% packet loss, time 4003ms
rtt min/avg/max/mdev = 771.325/1003.411/1192.571/159.962 ms, pipe 2
root@1263100019woiden:~# ping -c 5 -I 2a01:4f8:241:1f64:1111:1111:7c1b:4499 2001:67c:2b0:db32:0:1:101:101
PING 2001:67c:2b0:db32:0:1:101:101(2001:67c:2b0:db32:0:1:101:101) from 2a01:4f8:241:1f64:1111:1111:7c1b:4499 : 56 data bytes

--- 2001:67c:2b0:db32:0:1:101:101 ping statistics ---
5 packets transmitted, 0 received, 100% packet loss, time 4000ms
```

Running tcpdump simultaneously shows the packets in both cases exiting the machine through venet0, but only the ones from :1 receive responses:

```
root@1263100019woiden:~# tcpdump -ni venet0 icmp6
tcpdump: verbose output suppressed, use -v or -vv for full protocol decode
listening on venet0, link-type LINUX_SLL (Linux cooked v1), capture size 262144 bytes
14:11:51.008581 IP6 2a01:4f8:241:1f64:1111:1111:7c1b:1 > 2001:67c:2b0:db32:0:1:101:101: ICMP6, echo request, seq 1, length 64
14:11:51.779895 IP6 2001:67c:2b0:db32:0:1:101:101 > 2a01:4f8:241:1f64:1111:1111:7c1b:1: ICMP6, echo reply, seq 1, length 64
14:11:52.009481 IP6 2a01:4f8:241:1f64:1111:1111:7c1b:1 > 2001:67c:2b0:db32:0:1:101:101: ICMP6, echo request, seq 2, length 64
14:11:53.009313 IP6 2a01:4f8:241:1f64:1111:1111:7c1b:1 > 2001:67c:2b0:db32:0:1:101:101: ICMP6, echo request, seq 3, length 64
14:11:53.036361 IP6 2001:67c:2b0:db32:0:1:101:101 > 2a01:4f8:241:1f64:1111:1111:7c1b:1: ICMP6, echo reply, seq 2, length 64
14:11:54.010320 IP6 2a01:4f8:241:1f64:1111:1111:7c1b:1 > 2001:67c:2b0:db32:0:1:101:101: ICMP6, echo request, seq 4, length 64
14:11:54.159429 IP6 2001:67c:2b0:db32:0:1:101:101 > 2a01:4f8:241:1f64:1111:1111:7c1b:1: ICMP6, echo reply, seq 3, length 64
14:11:55.011290 IP6 2a01:4f8:241:1f64:1111:1111:7c1b:1 > 2001:67c:2b0:db32:0:1:101:101: ICMP6, echo request, seq 5, length 64
14:11:55.202851 IP6 2001:67c:2b0:db32:0:1:101:101 > 2a01:4f8:241:1f64:1111:1111:7c1b:1: ICMP6, echo reply, seq 4, length 64
14:11:55.887366 IP6 2001:67c:2b0:db32:0:1:101:101 > 2a01:4f8:241:1f64:1111:1111:7c1b:1: ICMP6, echo reply, seq 5, length 64
14:12:06.903632 IP6 2a01:4f8:241:1f64:1111:1111:7c1b:4499 > 2001:67c:2b0:db32:0:1:101:101: ICMP6, echo request, seq 1, length 64
14:12:07.903298 IP6 2a01:4f8:241:1f64:1111:1111:7c1b:4499 > 2001:67c:2b0:db32:0:1:101:101: ICMP6, echo request, seq 2, length 64
14:12:08.903308 IP6 2a01:4f8:241:1f64:1111:1111:7c1b:4499 > 2001:67c:2b0:db32:0:1:101:101: ICMP6, echo request, seq 3, length 64
14:12:09.903288 IP6 2a01:4f8:241:1f64:1111:1111:7c1b:4499 > 2001:67c:2b0:db32:0:1:101:101: ICMP6, echo request, seq 4, length 64
14:12:10.903294 IP6 2a01:4f8:241:1f64:1111:1111:7c1b:4499 > 2001:67c:2b0:db32:0:1:101:101: ICMP6, echo request, seq 5, length 64
```

So this issue is not caused by clatd, but rather your network environment denying your VM from assigning and using a secondary IPv6 address. Without a dedicated IPv6 address, clatd cannot function. I am therefore closing this issue.

Btw you asked me in the e-mail what my Twitter handle is, it is @toreanderson.

**Comment by tryeverything91** [comment]
Thank you very much for following up on the issue.

I could message you in Twitter cause of your privacy settings.
