### ISSUE TITLE
No returning traffic from 5G wwan established by NetworkManager

### ISSUE THREAD

**Issue by z0rb** [toreanderson/clatd#46]
Hi,

I have spent a couple of days trying to get clatd to work and I seem to be missing something.

The plan is to have clatd installed on a machine that has a 5G modem and is running Debian 13 (Trixie). The internet connection is established by NetworkManager. I have noticed that some carriers, e.g. the T-Mobile in Germany offers IPv6 with their own NAT64, but while roaming in Austria and elsewhere only provides IPv4. To cover all bases I would like to have clatd "kick in" when a network is encountered that only provides IPv6.

To implement this setup I have configured a wwan connection to only accept IPv6. DNS is configured with https://nat64.net :

```
[connection]
id=wwan
type=gsm
autoconnect=true

[gsm]
auto-config=true

[ipv4]
method=disabled

[ipv6]
addr-gen-mode=eui64
method=auto
ignore-auto-dns=true
ip6-privacy=0
dns=2a00:1098:2b::1;2a01:4f8:c2c:123f::1;2a00:1098:2c::1
```

The DNS should later be configured only in clatd so nat64.net is used as a backup and else auto-configured.

/etc/clatd.conf:
```
# systemd-resolved
dns64-servers=127.0.0.53,::1
ip6tables-enable=yes
debug=2
```
Before finding this issue: https://github.com/toreanderson/clatd/issues/44 , I figured out that ip6tables is not getting triggered hence the ip6tables-enable config.

My results are the same whether pointed to systemd-resolved as in the config here, directly configuring DNS for the system in /etc/resolv.conf or just using the DNS from the wwan connection.

Output of iptables-save is empty.

Output of ip6tables-save is:
```
# Generated by ip6tables-save v1.8.11 (nf_tables) on Mon Jan 27 16:06:46 2025
*filter
:INPUT ACCEPT [0:0]
:FORWARD ACCEPT [0:0]
:OUTPUT ACCEPT [0:0]
-A FORWARD -i wwp0s20f0u10i4 -o clat -j ACCEPT
-A FORWARD -i clat -o wwp0s20f0u10i4 -j ACCEPT
COMMIT
# Completed on Mon Jan 27 16:06:46 2025
```

nft ruleset:
```
table ip6 filter {
	chain FORWARD {
		type filter hook forward priority filter; policy accept;
		iifname "wwp0s20f0u10i4" oifname "clat" counter packets 0 bytes 0 accept
		iifname "clat" oifname "wwp0s20f0u10i4" counter packets 22 bytes 1760 accept
	}
}
```

clatd log:
```
Jan 27 12:11:58 machine-01 clatd[1339]: Configuration successfully read, dumping it:
Jan 27 12:11:58 machine-01 clatd[1339]:   clat-dev=clat
Jan 27 12:11:58 machine-01 clatd[1339]:   clat-v4-addr=192.0.0.1
Jan 27 12:11:58 machine-01 clatd[1339]:   clat-v6-addr=<undefined>
Jan 27 12:11:58 machine-01 clatd[1339]:   cmd-ip=ip
Jan 27 12:11:58 machine-01 clatd[1339]:   cmd-ip6tables=ip6tables
Jan 27 12:11:58 machine-01 clatd[1339]:   cmd-tayga=tayga
Jan 27 12:11:58 machine-01 clatd[1339]:   debug=2
Jan 27 12:11:58 machine-01 clatd[1339]:   dns64-servers=127.0.0.53,::1
Jan 27 12:11:58 machine-01 clatd[1339]:   forwarding-enable=1
Jan 27 12:11:58 machine-01 clatd[1339]:   ip6tables-enable=yes
Jan 27 12:11:58 machine-01 clatd[1339]:   plat-dev=<undefined>
Jan 27 12:11:58 machine-01 clatd[1339]:   plat-fallback-prefix=<undefined>
Jan 27 12:11:58 machine-01 clatd[1339]:   plat-prefix=<undefined>
Jan 27 12:11:58 machine-01 clatd[1339]:   proxynd-enable=1
Jan 27 12:11:58 machine-01 clatd[1339]:   quiet=0
Jan 27 12:11:58 machine-01 clatd[1339]:   script-down=<undefined>
Jan 27 12:11:58 machine-01 clatd[1339]:   script-up=<undefined>
Jan 27 12:11:58 machine-01 clatd[1339]:   tayga-conffile=<undefined>
Jan 27 12:11:58 machine-01 clatd[1339]:   tayga-v4-addr=192.0.0.2
Jan 27 12:11:58 machine-01 clatd[1339]:   v4-conncheck-delay=10
Jan 27 12:11:58 machine-01 clatd[1339]:   v4-conncheck-enable=1
Jan 27 12:11:58 machine-01 clatd[1339]:   v4-defaultroute-advmss=0
Jan 27 12:11:58 machine-01 clatd[1339]:   v4-defaultroute-enable=1
Jan 27 12:11:58 machine-01 clatd[1339]:   v4-defaultroute-metric=2048
Jan 27 12:11:58 machine-01 clatd[1339]:   v4-defaultroute-mtu=1260
Jan 27 12:11:58 machine-01 clatd[1339]:   v4-defaultroute-replace=0
Jan 27 12:11:58 machine-01 clatd[1339]: Starting clatd v1.6nat46 by Tore Anderson <tore@fud.no>
Jan 27 12:11:58 machine-01 clatd[1339]: Performing DNS64-based PLAT prefix discovery (cf. RFC 7050)
Jan 27 12:11:58 machine-01 clatd[1339]: cfg(dns64-servers)
Jan 27 12:11:58 machine-01 clatd[1339]: Looking up 'ipv4only.arpa' using DNS64 server 127.0.0.53
Jan 27 12:11:58 machine-01 clatd[1339]: No AAAA records was returned for 'ipv4only.arpa'
Jan 27 12:11:58 machine-01 clatd[1339]: Looking up 'ipv4only.arpa' using DNS64 server ::1
Jan 27 12:11:58 machine-01 clatd[1339]: No AAAA records was returned for 'ipv4only.arpa'
Jan 27 12:11:58 machine-01 clatd[1339]: No PLAT prefix could be discovered. Your ISP probably doesn't provide NAT64/DNS64 PLAT service. Exiting.
Jan 27 12:11:58 machine-01 systemd[1]: Started clatd.service - 464XLAT CLAT daemon.
Jan 27 12:11:58 machine-01 systemd[1]: clatd.service: Deactivated successfully.
Jan 27 12:12:34 machine-01 systemd[1]: Started clatd.service - 464XLAT CLAT daemon.
Jan 27 12:12:34 machine-01 clatd[1446]: Configuration successfully read, dumping it:
Jan 27 12:12:34 machine-01 clatd[1446]:   clat-dev=clat
Jan 27 12:12:34 machine-01 clatd[1446]:   clat-v4-addr=192.0.0.1
Jan 27 12:12:34 machine-01 clatd[1446]:   clat-v6-addr=<undefined>
Jan 27 12:12:34 machine-01 clatd[1446]:   cmd-ip=ip
Jan 27 12:12:34 machine-01 clatd[1446]:   cmd-ip6tables=ip6tables
Jan 27 12:12:34 machine-01 clatd[1446]:   cmd-tayga=tayga
Jan 27 12:12:34 machine-01 clatd[1446]:   debug=2
Jan 27 12:12:34 machine-01 clatd[1446]:   dns64-servers=127.0.0.53,::1
Jan 27 12:12:34 machine-01 clatd[1446]:   forwarding-enable=1
Jan 27 12:12:34 machine-01 clatd[1446]:   ip6tables-enable=yes
Jan 27 12:12:34 machine-01 clatd[1446]:   plat-dev=<undefined>
Jan 27 12:12:34 machine-01 clatd[1446]:   plat-fallback-prefix=<undefined>
Jan 27 12:12:34 machine-01 clatd[1446]:   plat-prefix=<undefined>
Jan 27 12:12:34 machine-01 clatd[1446]:   proxynd-enable=1
Jan 27 12:12:34 machine-01 clatd[1446]:   quiet=0
Jan 27 12:12:34 machine-01 clatd[1446]:   script-down=<undefined>
Jan 27 12:12:34 machine-01 clatd[1446]:   script-up=<undefined>
Jan 27 12:12:34 machine-01 clatd[1446]:   tayga-conffile=<undefined>
Jan 27 12:12:34 machine-01 clatd[1446]:   tayga-v4-addr=192.0.0.2
Jan 27 12:12:34 machine-01 clatd[1446]:   v4-conncheck-delay=10
Jan 27 12:12:34 machine-01 clatd[1446]:   v4-conncheck-enable=1
Jan 27 12:12:34 machine-01 clatd[1446]:   v4-defaultroute-advmss=0
Jan 27 12:12:34 machine-01 clatd[1446]:   v4-defaultroute-enable=1
Jan 27 12:12:34 machine-01 clatd[1446]:   v4-defaultroute-metric=2048
Jan 27 12:12:34 machine-01 clatd[1446]:   v4-defaultroute-mtu=1260
Jan 27 12:12:34 machine-01 clatd[1446]:   v4-defaultroute-replace=0
Jan 27 12:12:34 machine-01 clatd[1446]: Starting clatd v1.6nat46 by Tore Anderson <tore@fud.no>
Jan 27 12:12:34 machine-01 clatd[1446]: Performing DNS64-based PLAT prefix discovery (cf. RFC 7050)
Jan 27 12:12:34 machine-01 clatd[1446]: cfg(dns64-servers)
Jan 27 12:12:34 machine-01 clatd[1446]: Looking up 'ipv4only.arpa' using DNS64 server 127.0.0.53
Jan 27 12:12:34 machine-01 clatd[1446]: check_wka(): Testing to see if 2a01:4f8:c2c:123f:64:5:c000:ab was DNS64-synthesised
Jan 27 12:12:34 machine-01 clatd[1446]: Looking for Well-Known Addresses at prefix length /96
Jan 27 12:12:34 machine-01 clatd[1446]: Looking for WKA ::c000:aa
Jan 27 12:12:34 machine-01 clatd[1446]: Didn't find it
Jan 27 12:12:34 machine-01 clatd[1446]: Looking for WKA ::c000:ab
Jan 27 12:12:34 machine-01 clatd[1446]: Found it!
Jan 27 12:12:34 machine-01 clatd[1446]: Inferred PLAT prefix 2a01:4f8:c2c:123f:64:5::/96 from AAAA record 2a01:4f8:c2c:123f:64:5:c000:ab
Jan 27 12:12:34 machine-01 clatd[1446]: check_wka(): Testing to see if 2a00:1098:2c:0:0:5:c000:ab was DNS64-synthesised
Jan 27 12:12:34 machine-01 clatd[1446]: Looking for Well-Known Addresses at prefix length /96
Jan 27 12:12:34 machine-01 clatd[1446]: Looking for WKA ::c000:aa
Jan 27 12:12:34 machine-01 clatd[1446]: Didn't find it
Jan 27 12:12:34 machine-01 clatd[1446]: Looking for WKA ::c000:ab
Jan 27 12:12:34 machine-01 clatd[1446]: Found it!
Jan 27 12:12:34 machine-01 clatd[1446]: Inferred PLAT prefix 2a00:1098:2c::5:0:0/96 from AAAA record 2a00:1098:2c:0:0:5:c000:ab
Jan 27 12:12:34 machine-01 clatd[1446]: check_wka(): Testing to see if 2a00:1098:2b:0:0:1:c000:aa was DNS64-synthesised
Jan 27 12:12:34 machine-01 clatd[1446]: Looking for Well-Known Addresses at prefix length /96
Jan 27 12:12:34 machine-01 clatd[1446]: Looking for WKA ::c000:aa
Jan 27 12:12:34 machine-01 clatd[1446]: Found it!
Jan 27 12:12:34 machine-01 clatd[1446]: Inferred PLAT prefix 2a00:1098:2b::1:0:0/96 from AAAA record 2a00:1098:2b:0:0:1:c000:aa
Jan 27 12:12:34 machine-01 clatd[1446]: check_wka(): Testing to see if 2a01:4f8:c2c:123f:64:5:c000:aa was DNS64-synthesised
Jan 27 12:12:34 machine-01 clatd[1446]: Looking for Well-Known Addresses at prefix length /96
Jan 27 12:12:34 machine-01 clatd[1446]: Looking for WKA ::c000:aa
Jan 27 12:12:34 machine-01 clatd[1446]: Found it!
Jan 27 12:12:34 machine-01 clatd[1446]: Inferred PLAT prefix 2a01:4f8:c2c:123f:64:5::/96 from AAAA record 2a01:4f8:c2c:123f:64:5:c000:aa
Jan 27 12:12:34 machine-01 clatd[1446]: check_wka(): Testing to see if 2a00:1098:2b:0:0:1:c000:ab was DNS64-synthesised
Jan 27 12:12:34 machine-01 clatd[1446]: Looking for Well-Known Addresses at prefix length /96
Jan 27 12:12:34 machine-01 clatd[1446]: Looking for WKA ::c000:aa
Jan 27 12:12:34 machine-01 clatd[1446]: Didn't find it
Jan 27 12:12:34 machine-01 clatd[1446]: Looking for WKA ::c000:ab
Jan 27 12:12:34 machine-01 clatd[1446]: Found it!
Jan 27 12:12:34 machine-01 clatd[1446]: Inferred PLAT prefix 2a00:1098:2b::1:0:0/96 from AAAA record 2a00:1098:2b:0:0:1:c000:ab
Jan 27 12:12:34 machine-01 clatd[1446]: check_wka(): Testing to see if 2a00:1098:2c:0:0:5:c000:aa was DNS64-synthesised
Jan 27 12:12:34 machine-01 clatd[1446]: Looking for Well-Known Addresses at prefix length /96
Jan 27 12:12:34 machine-01 clatd[1446]: Looking for WKA ::c000:aa
Jan 27 12:12:34 machine-01 clatd[1446]: Found it!
Jan 27 12:12:34 machine-01 clatd[1446]: Inferred PLAT prefix 2a00:1098:2c::5:0:0/96 from AAAA record 2a00:1098:2c:0:0:5:c000:aa
Jan 27 12:12:34 machine-01 clatd[1446]: Looking up 'ipv4only.arpa' using DNS64 server ::1
Jan 27 12:12:34 machine-01 clatd[1446]: check_wka(): Testing to see if 2a00:1098:2b:0:0:1:c000:aa was DNS64-synthesised
Jan 27 12:12:34 machine-01 clatd[1446]: Looking for Well-Known Addresses at prefix length /96
Jan 27 12:12:34 machine-01 clatd[1446]: Looking for WKA ::c000:aa
Jan 27 12:12:34 machine-01 clatd[1446]: Found it!
Jan 27 12:12:34 machine-01 clatd[1446]: Inferred PLAT prefix 2a00:1098:2b::1:0:0/96 from AAAA record 2a00:1098:2b:0:0:1:c000:aa
Jan 27 12:12:34 machine-01 clatd[1446]: check_wka(): Testing to see if 2a00:1098:2b:0:0:1:c000:ab was DNS64-synthesised
Jan 27 12:12:34 machine-01 clatd[1446]: Looking for Well-Known Addresses at prefix length /96
Jan 27 12:12:34 machine-01 clatd[1446]: Looking for WKA ::c000:aa
Jan 27 12:12:34 machine-01 clatd[1446]: Didn't find it
Jan 27 12:12:34 machine-01 clatd[1446]: Looking for WKA ::c000:ab
Jan 27 12:12:34 machine-01 clatd[1446]: Found it!
Jan 27 12:12:34 machine-01 clatd[1446]: Inferred PLAT prefix 2a00:1098:2b::1:0:0/96 from AAAA record 2a00:1098:2b:0:0:1:c000:ab
Jan 27 12:12:34 machine-01 clatd[1446]: check_wka(): Testing to see if 2a01:4f8:c2c:123f:64:5:c000:aa was DNS64-synthesised
Jan 27 12:12:34 machine-01 clatd[1446]: Looking for Well-Known Addresses at prefix length /96
Jan 27 12:12:34 machine-01 clatd[1446]: Looking for WKA ::c000:aa
Jan 27 12:12:34 machine-01 clatd[1446]: Found it!
Jan 27 12:12:34 machine-01 clatd[1446]: Inferred PLAT prefix 2a01:4f8:c2c:123f:64:5::/96 from AAAA record 2a01:4f8:c2c:123f:64:5:c000:aa
Jan 27 12:12:34 machine-01 clatd[1446]: check_wka(): Testing to see if 2a01:4f8:c2c:123f:64:5:c000:ab was DNS64-synthesised
Jan 27 12:12:34 machine-01 clatd[1446]: Looking for Well-Known Addresses at prefix length /96
Jan 27 12:12:34 machine-01 clatd[1446]: Looking for WKA ::c000:aa
Jan 27 12:12:34 machine-01 clatd[1446]: Didn't find it
Jan 27 12:12:34 machine-01 clatd[1446]: Looking for WKA ::c000:ab
Jan 27 12:12:34 machine-01 clatd[1446]: Found it!
Jan 27 12:12:34 machine-01 clatd[1446]: Inferred PLAT prefix 2a01:4f8:c2c:123f:64:5::/96 from AAAA record 2a01:4f8:c2c:123f:64:5:c000:ab
Jan 27 12:12:34 machine-01 clatd[1446]: check_wka(): Testing to see if 2a00:1098:2c:0:0:5:c000:aa was DNS64-synthesised
Jan 27 12:12:34 machine-01 clatd[1446]: Looking for Well-Known Addresses at prefix length /96
Jan 27 12:12:34 machine-01 clatd[1446]: Looking for WKA ::c000:aa
Jan 27 12:12:34 machine-01 clatd[1446]: Found it!
Jan 27 12:12:34 machine-01 clatd[1446]: Inferred PLAT prefix 2a00:1098:2c::5:0:0/96 from AAAA record 2a00:1098:2c:0:0:5:c000:aa
Jan 27 12:12:34 machine-01 clatd[1446]: check_wka(): Testing to see if 2a00:1098:2c:0:0:5:c000:ab was DNS64-synthesised
Jan 27 12:12:34 machine-01 clatd[1446]: Looking for Well-Known Addresses at prefix length /96
Jan 27 12:12:34 machine-01 clatd[1446]: Looking for WKA ::c000:aa
Jan 27 12:12:34 machine-01 clatd[1446]: Didn't find it
Jan 27 12:12:34 machine-01 clatd[1446]: Looking for WKA ::c000:ab
Jan 27 12:12:34 machine-01 clatd[1446]: Found it!
Jan 27 12:12:34 machine-01 clatd[1446]: Inferred PLAT prefix 2a00:1098:2c::5:0:0/96 from AAAA record 2a00:1098:2c:0:0:5:c000:ab
Jan 27 12:12:34 machine-01 clatd[1446]: <warn> Multiple PLAT prefixes discovered (2a01:4f8:c2c:123f:64:5::/96 2a00:1098:2c::5:0:0/96 2a00:1098:2b::1:0:0/96), using the first seen
Jan 27 12:12:34 machine-01 clatd[1446]: Using PLAT (NAT64) prefix: 2a01:4f8:c2c:123f:64:5::/96
Jan 27 12:12:34 machine-01 clatd[1446]: get_plat_dev(): finding which network dev faces the PLAT
Jan 27 12:12:34 machine-01 clatd[1446]: cfg(plat-prefix)
Jan 27 12:12:34 machine-01 clatd[1446]: cfg(cmd-ip)
Jan 27 12:12:34 machine-01 clatd[1446]: get_plat_dev(): Found PLAT-facing device: wwp0s20f0u10i4
Jan 27 12:12:34 machine-01 clatd[1446]: Device facing the PLAT: wwp0s20f0u10i4
Jan 27 12:12:34 machine-01 clatd[1446]: cfg(plat-dev)
Jan 27 12:12:34 machine-01 clatd[1446]: cfg(plat-prefix)
Jan 27 12:12:34 machine-01 clatd[1446]: Attempting to derive a CLAT IPv6 address from an IPv6 address on 'wwp0s20f0u10i4'
Jan 27 12:12:34 machine-01 clatd[1446]: cfg(cmd-ip)
Jan 27 12:12:44 machine-01 clatd[1446]: Saw a candidate address on 'wwp0s20f0u10i4': 2001:4bb8:1b0:7a57:a9fd:6bed:c9d8:8cd1/64
Jan 27 12:12:44 machine-01 clatd[1446]: Preferring 2001:4bb8:1b0:7a57:a9fd:6bed:c9d8:8cd1/64; best match so far
Jan 27 12:12:44 machine-01 clatd[1446]: Using random interface ID: d77252032a230000
Jan 27 12:12:44 machine-01 clatd[1446]: Using CLAT IPv4 address: 192.0.0.1
Jan 27 12:12:44 machine-01 clatd[1446]: Using CLAT IPv6 address: 2001:4bb8:1b0:7a57:d772:5203:2a23:0
Jan 27 12:12:44 machine-01 clatd[1446]: cfgint(v4-defaultroute-mtu)
Jan 27 12:12:44 machine-01 clatd[1446]: cfgbool(v4-conncheck-enable)
Jan 27 12:12:44 machine-01 clatd[1446]: cfgbool(v4-defaultroute-replace)
Jan 27 12:12:44 machine-01 clatd[1446]: cfgint(v4-conncheck-delay)
Jan 27 12:12:44 machine-01 clatd[1446]: Checking if this system already has IPv4 connectivity in 10 sec(s)
Jan 27 12:12:44 machine-01 clatd[1446]: cfg(cmd-ip)
Jan 27 12:12:44 machine-01 clatd[1446]: cfg(tayga-conffile)
Jan 27 12:12:44 machine-01 clatd[1446]: Using temporary conffile for TAYGA: /tmp/mob_XG767S
Jan 27 12:12:44 machine-01 clatd[1446]: cfg(clat-dev)
Jan 27 12:12:44 machine-01 clatd[1446]: cfg(plat-prefix)
Jan 27 12:12:44 machine-01 clatd[1446]: cfg(tayga-v4-addr)
Jan 27 12:12:44 machine-01 clatd[1446]: cfg(clat-v4-addr)
Jan 27 12:12:44 machine-01 clatd[1446]: cfg(clat-v6-addr)
Jan 27 12:12:44 machine-01 clatd[1446]: cfgbool(forwarding-enable)
Jan 27 12:12:44 machine-01 clatd[1446]: Reading sysctl /proc/sys/net/ipv6/conf/all/forwarding
Jan 27 12:12:44 machine-01 clatd[1446]: /proc/sys/net/ipv6/conf/all/forwarding is set to '0'
Jan 27 12:12:44 machine-01 clatd[1446]: Enabling IPv6 forwarding
Jan 27 12:12:44 machine-01 clatd[1446]: Reading sysctl /proc/sys/net/ipv6/conf/default/accept_ra
Jan 27 12:12:44 machine-01 clatd[1446]: /proc/sys/net/ipv6/conf/default/accept_ra is set to '1'
Jan 27 12:12:44 machine-01 clatd[1446]: Changing /proc/sys/net/ipv6/conf/default/accept_ra from 1 to 2 to prevent connectivity loss after enabling IPv6 forwarding
Jan 27 12:12:44 machine-01 clatd[1446]: Setting sysctl /proc/sys/net/ipv6/conf/default/accept_ra=2
Jan 27 12:12:44 machine-01 clatd[1446]: Reading sysctl /proc/sys/net/ipv6/conf/eno1/accept_ra
Jan 27 12:12:44 machine-01 clatd[1446]: /proc/sys/net/ipv6/conf/eno1/accept_ra is set to '1'
Jan 27 12:12:44 machine-01 clatd[1446]: Changing /proc/sys/net/ipv6/conf/eno1/accept_ra from 1 to 2 to prevent connectivity loss after enabling IPv6 forwarding
Jan 27 12:12:44 machine-01 clatd[1446]: Setting sysctl /proc/sys/net/ipv6/conf/eno1/accept_ra=2
Jan 27 12:12:44 machine-01 clatd[1446]: Reading sysctl /proc/sys/net/ipv6/conf/enp3s0/accept_ra
Jan 27 12:12:44 machine-01 clatd[1446]: /proc/sys/net/ipv6/conf/enp3s0/accept_ra is set to '1'
Jan 27 12:12:44 machine-01 clatd[1446]: Changing /proc/sys/net/ipv6/conf/enp3s0/accept_ra from 1 to 2 to prevent connectivity loss after enabling IPv6 forwarding
Jan 27 12:12:44 machine-01 clatd[1446]: Setting sysctl /proc/sys/net/ipv6/conf/enp3s0/accept_ra=2
Jan 27 12:12:44 machine-01 clatd[1446]: Reading sysctl /proc/sys/net/ipv6/conf/enp4s0/accept_ra
Jan 27 12:12:44 machine-01 clatd[1446]: /proc/sys/net/ipv6/conf/enp4s0/accept_ra is set to '1'
Jan 27 12:12:44 machine-01 clatd[1446]: Changing /proc/sys/net/ipv6/conf/enp4s0/accept_ra from 1 to 2 to prevent connectivity loss after enabling IPv6 forwarding
Jan 27 12:12:44 machine-01 clatd[1446]: Setting sysctl /proc/sys/net/ipv6/conf/enp4s0/accept_ra=2
Jan 27 12:12:44 machine-01 clatd[1446]: Reading sysctl /proc/sys/net/ipv6/conf/enp5s0/accept_ra
Jan 27 12:12:44 machine-01 clatd[1446]: /proc/sys/net/ipv6/conf/enp5s0/accept_ra is set to '1'
Jan 27 12:12:44 machine-01 clatd[1446]: Changing /proc/sys/net/ipv6/conf/enp5s0/accept_ra from 1 to 2 to prevent connectivity loss after enabling IPv6 forwarding
Jan 27 12:12:44 machine-01 clatd[1446]: Setting sysctl /proc/sys/net/ipv6/conf/enp5s0/accept_ra=2
Jan 27 12:12:44 machine-01 clatd[1446]: Reading sysctl /proc/sys/net/ipv6/conf/enp6s0/accept_ra
Jan 27 12:12:44 machine-01 clatd[1446]: /proc/sys/net/ipv6/conf/enp6s0/accept_ra is set to '1'
Jan 27 12:12:44 machine-01 clatd[1446]: Changing /proc/sys/net/ipv6/conf/enp6s0/accept_ra from 1 to 2 to prevent connectivity loss after enabling IPv6 forwarding
Jan 27 12:12:44 machine-01 clatd[1446]: Setting sysctl /proc/sys/net/ipv6/conf/enp6s0/accept_ra=2
Jan 27 12:12:44 machine-01 clatd[1446]: Reading sysctl /proc/sys/net/ipv6/conf/enp7s0/accept_ra
Jan 27 12:12:44 machine-01 clatd[1446]: /proc/sys/net/ipv6/conf/enp7s0/accept_ra is set to '1'
Jan 27 12:12:44 machine-01 clatd[1446]: Changing /proc/sys/net/ipv6/conf/enp7s0/accept_ra from 1 to 2 to prevent connectivity loss after enabling IPv6 forwarding
Jan 27 12:12:44 machine-01 clatd[1446]: Setting sysctl /proc/sys/net/ipv6/conf/enp7s0/accept_ra=2
Jan 27 12:12:44 machine-01 clatd[1446]: Reading sysctl /proc/sys/net/ipv6/conf/enp8s0/accept_ra
Jan 27 12:12:44 machine-01 clatd[1446]: /proc/sys/net/ipv6/conf/enp8s0/accept_ra is set to '1'
Jan 27 12:12:44 machine-01 clatd[1446]: Changing /proc/sys/net/ipv6/conf/enp8s0/accept_ra from 1 to 2 to prevent connectivity loss after enabling IPv6 forwarding
Jan 27 12:12:44 machine-01 clatd[1446]: Setting sysctl /proc/sys/net/ipv6/conf/enp8s0/accept_ra=2
Jan 27 12:12:44 machine-01 clatd[1446]: Reading sysctl /proc/sys/net/ipv6/conf/enp9s0/accept_ra
Jan 27 12:12:44 machine-01 clatd[1446]: /proc/sys/net/ipv6/conf/enp9s0/accept_ra is set to '1'
Jan 27 12:12:44 machine-01 clatd[1446]: Changing /proc/sys/net/ipv6/conf/enp9s0/accept_ra from 1 to 2 to prevent connectivity loss after enabling IPv6 forwarding
Jan 27 12:12:44 machine-01 clatd[1446]: Setting sysctl /proc/sys/net/ipv6/conf/enp9s0/accept_ra=2
Jan 27 12:12:44 machine-01 clatd[1446]: Reading sysctl /proc/sys/net/ipv6/conf/lo/accept_ra
Jan 27 12:12:44 machine-01 clatd[1446]: /proc/sys/net/ipv6/conf/lo/accept_ra is set to '1'
Jan 27 12:12:44 machine-01 clatd[1446]: Changing /proc/sys/net/ipv6/conf/lo/accept_ra from 1 to 2 to prevent connectivity loss after enabling IPv6 forwarding
Jan 27 12:12:44 machine-01 clatd[1446]: Setting sysctl /proc/sys/net/ipv6/conf/lo/accept_ra=2
Jan 27 12:12:44 machine-01 clatd[1446]: Reading sysctl /proc/sys/net/ipv6/conf/wlp2s0/accept_ra
Jan 27 12:12:44 machine-01 clatd[1446]: /proc/sys/net/ipv6/conf/wlp2s0/accept_ra is set to '1'
Jan 27 12:12:44 machine-01 clatd[1446]: Changing /proc/sys/net/ipv6/conf/wlp2s0/accept_ra from 1 to 2 to prevent connectivity loss after enabling IPv6 forwarding
Jan 27 12:12:44 machine-01 clatd[1446]: Setting sysctl /proc/sys/net/ipv6/conf/wlp2s0/accept_ra=2
Jan 27 12:12:44 machine-01 clatd[1446]: Reading sysctl /proc/sys/net/ipv6/conf/wwp0s20f0u10i4/accept_ra
Jan 27 12:12:44 machine-01 clatd[1446]: /proc/sys/net/ipv6/conf/wwp0s20f0u10i4/accept_ra is set to '0'
Jan 27 12:12:44 machine-01 clatd[1446]: Setting sysctl /proc/sys/net/ipv6/conf/all/forwarding=1
Jan 27 12:12:44 machine-01 clatd[1446]: cfgbool(ip6tables-enable)
Jan 27 12:12:44 machine-01 clatd[1446]: Adding ip6tables rules allowing traffic between the CLAT and PLAT devices
Jan 27 12:12:44 machine-01 clatd[1446]: cfg(cmd-ip6tables)
Jan 27 12:12:44 machine-01 clatd[1446]: cfg(clat-dev)
Jan 27 12:12:44 machine-01 clatd[1446]: cfg(plat-dev)
Jan 27 12:12:44 machine-01 clatd[1446]: cmd(ip6tables -I FORWARD -i clat -o wwp0s20f0u10i4 -j ACCEPT)
Jan 27 12:12:44 machine-01 clatd[1446]: cfg(cmd-ip6tables)
Jan 27 12:12:44 machine-01 clatd[1446]: cfg(plat-dev)
Jan 27 12:12:44 machine-01 clatd[1446]: cfg(clat-dev)
Jan 27 12:12:44 machine-01 clatd[1446]: cmd(ip6tables -I FORWARD -i wwp0s20f0u10i4 -o clat -j ACCEPT)
Jan 27 12:12:44 machine-01 clatd[1446]: cfgbool(proxynd-enable)
Jan 27 12:12:44 machine-01 clatd[1446]: cfg(plat-dev)
Jan 27 12:12:44 machine-01 clatd[1446]: cfg(clat-v6-addr)
Jan 27 12:12:44 machine-01 clatd[1446]: Enabling Proxy-ND for 2001:4bb8:1b0:7a57:d772:5203:2a23:0 on wwp0s20f0u10i4
Jan 27 12:12:44 machine-01 clatd[1446]: Reading sysctl /proc/sys/net/ipv6/conf/wwp0s20f0u10i4/proxy_ndp
Jan 27 12:12:44 machine-01 clatd[1446]: /proc/sys/net/ipv6/conf/wwp0s20f0u10i4/proxy_ndp is set to '0'
Jan 27 12:12:44 machine-01 clatd[1446]: Setting sysctl /proc/sys/net/ipv6/conf/wwp0s20f0u10i4/proxy_ndp=1
Jan 27 12:12:44 machine-01 clatd[1446]: Enabled Proxy-ND sysctl for wwp0s20f0u10i4
Jan 27 12:12:44 machine-01 clatd[1446]: cfg(cmd-ip)
Jan 27 12:12:44 machine-01 clatd[1446]: cfg(clat-v6-addr)
Jan 27 12:12:44 machine-01 clatd[1446]: cfg(plat-dev)
Jan 27 12:12:44 machine-01 clatd[1446]: cmd(ip -6 neighbour add proxy 2001:4bb8:1b0:7a57:d772:5203:2a23:0 dev wwp0s20f0u10i4)
Jan 27 12:12:44 machine-01 clatd[1446]: cfg(clat-dev)
Jan 27 12:12:44 machine-01 clatd[1446]: Creating and configuring up CLAT device 'clat'
Jan 27 12:12:44 machine-01 clatd[1446]: cfg(cmd-tayga)
Jan 27 12:12:44 machine-01 clatd[1446]: cfg(tayga-conffile)
Jan 27 12:12:44 machine-01 clatd[1446]: cfgint(debug)
Jan 27 12:12:44 machine-01 clatd[1446]: cmd(tayga --config /tmp/mob_XG767S --mktun -d)
Jan 27 12:12:44 machine-01 clatd[1459]: Created persistent tun device clat
Jan 27 12:12:44 machine-01 clatd[1446]: cfg(cmd-ip)
Jan 27 12:12:44 machine-01 clatd[1446]: cfg(clat-dev)
Jan 27 12:12:44 machine-01 clatd[1446]: cmd(ip link set up dev clat)
Jan 27 12:12:44 machine-01 clatd[1446]: cfg(cmd-ip)
Jan 27 12:12:44 machine-01 clatd[1446]: cfg(clat-v4-addr)
Jan 27 12:12:44 machine-01 clatd[1446]: cfg(clat-dev)
Jan 27 12:12:44 machine-01 clatd[1446]: cmd(ip -4 address add 192.0.0.1 dev clat)
Jan 27 12:12:44 machine-01 clatd[1446]: cfg(cmd-ip)
Jan 27 12:12:44 machine-01 clatd[1446]: cfg(clat-v6-addr)
Jan 27 12:12:44 machine-01 clatd[1446]: cfg(clat-dev)
Jan 27 12:12:44 machine-01 clatd[1446]: cmd(ip -6 route add 2001:4bb8:1b0:7a57:d772:5203:2a23:0 dev clat)
Jan 27 12:12:44 machine-01 clatd[1446]: cfgbool(v4-defaultroute-replace)
Jan 27 12:12:44 machine-01 clatd[1446]: cfgbool(v4-defaultroute-enable)
Jan 27 12:12:44 machine-01 clatd[1446]: cfg(clat-dev)
Jan 27 12:12:44 machine-01 clatd[1446]: cfgint(v4-defaultroute-metric)
Jan 27 12:12:44 machine-01 clatd[1446]: cfgint(v4-defaultroute-metric)
Jan 27 12:12:44 machine-01 clatd[1446]: cfgint(v4-defaultroute-mtu)
Jan 27 12:12:44 machine-01 clatd[1446]: cfgint(v4-defaultroute-mtu)
Jan 27 12:12:44 machine-01 clatd[1446]: cfgint(v4-defaultroute-advmss)
Jan 27 12:12:44 machine-01 clatd[1446]: cfgint(v4-defaultroute-advmss)
Jan 27 12:12:44 machine-01 clatd[1446]: Adding IPv4 default route via the CLAT
Jan 27 12:12:44 machine-01 clatd[1446]: cfg(cmd-ip)
Jan 27 12:12:44 machine-01 clatd[1446]: cmd(ip -4 route add default dev clat metric 2048 mtu 1260 advmss 1220)
Jan 27 12:12:44 machine-01 clatd[1446]: Script env: clat-dev=clat
Jan 27 12:12:44 machine-01 clatd[1446]: Script env: clat-v4-addr=192.0.0.1
Jan 27 12:12:44 machine-01 clatd[1446]: Script env: clat-v6-addr=2001:4bb8:1b0:7a57:d772:5203:2a23:0
Jan 27 12:12:44 machine-01 clatd[1446]: Script env: cmd-ip=ip
Jan 27 12:12:44 machine-01 clatd[1446]: Script env: cmd-ip6tables=ip6tables
Jan 27 12:12:44 machine-01 clatd[1446]: Script env: cmd-tayga=tayga
Jan 27 12:12:44 machine-01 clatd[1446]: Script env: debug=2
Jan 27 12:12:44 machine-01 clatd[1446]: Script env: dns64-servers=127.0.0.53,::1
Jan 27 12:12:44 machine-01 clatd[1446]: Script env: forwarding-enable=1
Jan 27 12:12:44 machine-01 clatd[1446]: Script env: ip6tables-enable=yes
Jan 27 12:12:44 machine-01 clatd[1446]: Script env: plat-dev=wwp0s20f0u10i4
Jan 27 12:12:44 machine-01 clatd[1446]: Script env: plat-fallback-prefix=
Jan 27 12:12:44 machine-01 clatd[1446]: Script env: plat-prefix=2a01:4f8:c2c:123f:64:5::/96
Jan 27 12:12:44 machine-01 clatd[1446]: Script env: proxynd-enable=1
Jan 27 12:12:44 machine-01 clatd[1446]: Script env: quiet=
Jan 27 12:12:44 machine-01 clatd[1446]: Script env: script-down=
Jan 27 12:12:44 machine-01 clatd[1446]: Script env: script-up=
Jan 27 12:12:44 machine-01 clatd[1446]: Script env: tayga-conffile=/tmp/mob_XG767S
Jan 27 12:12:44 machine-01 clatd[1446]: Script env: tayga-v4-addr=192.0.0.2
Jan 27 12:12:44 machine-01 clatd[1446]: Script env: v4-conncheck-delay=10
Jan 27 12:12:44 machine-01 clatd[1446]: Script env: v4-conncheck-enable=1
Jan 27 12:12:44 machine-01 clatd[1446]: Script env: v4-defaultroute-advmss=1220
Jan 27 12:12:44 machine-01 clatd[1446]: Script env: v4-defaultroute-enable=1
Jan 27 12:12:44 machine-01 clatd[1446]: Script env: v4-defaultroute-metric=2048
Jan 27 12:12:44 machine-01 clatd[1446]: Script env: v4-defaultroute-mtu=1260
Jan 27 12:12:44 machine-01 clatd[1446]: Script env: v4-defaultroute-replace=
Jan 27 12:12:44 machine-01 clatd[1446]: cfg(script-up)
Jan 27 12:12:44 machine-01 clatd[1446]: cfg(tayga-conffile)
Jan 27 12:12:44 machine-01 clatd[1446]: Starting up TAYGA, using config file '/tmp/mob_XG767S'
Jan 27 12:12:44 machine-01 clatd[1446]: cfg(cmd-tayga)
Jan 27 12:12:44 machine-01 clatd[1446]: cfg(tayga-conffile)
Jan 27 12:12:44 machine-01 clatd[1446]: cfgint(debug)
Jan 27 12:12:44 machine-01 clatd[1446]: cmd(tayga --config /tmp/mob_XG767S --nodetach -d)
```
tayga config in /tmp:
```
# Ephemeral TAYGA config file written by /usr/sbin/clatd
# This file may be safely deleted at any time.
tun-device clat
prefix 2a01:4f8:c2c:123f:64:5::/96
ipv4-addr 192.0.0.2
map 192.0.0.1 2001:4bb8:1b0:7a57:d772:5203:2a23:0
```

Executed a dig towards 1.1.1.1 as suggested in other issues with the dump on the clat interface:
```
13:43:46.483150 IP (tos 0x0, ttl 64, id 5159, offset 0, flags [DF], proto TCP (6), length 60)
    machine-01.43555 > one.one.one.one.domain: Flags [S], cksum 0xb8ca (correct), seq 1695504127, win 64660, options [mss 1220,sackOK,TS val 1101015430 ecr 0,nop,wscale 7], length 0
13:43:46.483214 IP6 (hlim 63, next-header TCP (6) payload length: 40) machine-01.43555 > one.one.one.one.domain: Flags [S], cksum 0x1d30 (correct), seq 1695504127, win 64660, options [mss 1220,sackOK,TS val 1101015430 ecr 0,nop,wscale 7], length 0
13:43:47.508539 IP (tos 0x0, ttl 64, id 5160, offset 0, flags [DF], proto TCP (6), length 60)
    machine-01.43555 > one.one.one.one.domain: Flags [S], cksum 0xb4c8 (correct), seq 1695504127, win 64660, options [mss 1220,sackOK,TS val 1101016456 ecr 0,nop,wscale 7], length 0
13:43:47.508660 IP6 (hlim 63, next-header TCP (6) payload length: 40) machine-01.43555 > one.one.one.one.domain: Flags [S], cksum 0x192e (correct), seq 1695504127, win 64660, options [mss 1220,sackOK,TS val 1101016456 ecr 0,nop,wscale 7], length 0
13:43:48.532553 IP (tos 0x0, ttl 64, id 5161, offset 0, flags [DF], proto TCP (6), length 60)
    machine-01.43555 > one.one.one.one.domain: Flags [S], cksum 0xb0c8 (correct), seq 1695504127, win 64660, options [mss 1220,sackOK,TS val 1101017480 ecr 0,nop,wscale 7], length 0
13:43:48.532668 IP6 (hlim 63, next-header TCP (6) payload length: 40) machine-01.43555 > one.one.one.one.domain: Flags [S], cksum 0x152e (correct), seq 1695504127, win 64660, options [mss 1220,sackOK,TS val 1101017480 ecr 0,nop,wscale 7], length 0
13:43:49.556571 IP (tos 0x0, ttl 64, id 5162, offset 0, flags [DF], proto TCP (6), length 60)
    machine-01.43555 > one.one.one.one.domain: Flags [S], cksum 0xacc8 (correct), seq 1695504127, win 64660, options [mss 1220,sackOK,TS val 1101018504 ecr 0,nop,wscale 7], length 0
13:43:49.556672 IP6 (hlim 63, next-header TCP (6) payload length: 40) machine-01.43555 > one.one.one.one.domain: Flags [S], cksum 0x112e (correct), seq 1695504127, win 64660, options [mss 1220,sackOK,TS val 1101018504 ecr 0,nop,wscale 7], length 0
13:43:50.580587 IP (tos 0x0, ttl 64, id 5163, offset 0, flags [DF], proto TCP (6), length 60)
    machine-01.43555 > one.one.one.one.domain: Flags [S], cksum 0xa8c8 (correct), seq 1695504127, win 64660, options [mss 1220,sackOK,TS val 1101019528 ecr 0,nop,wscale 7], length 0
13:43:50.580716 IP6 (hlim 63, next-header TCP (6) payload length: 40) machine-01.43555 > one.one.one.one.domain: Flags [S], cksum 0x0d2e (correct), seq 1695504127, win 64660, options [mss 1220,sackOK,TS val 1101019528 ecr 0,nop,wscale 7], length 0
13:43:51.604578 IP (tos 0x0, ttl 64, id 5164, offset 0, flags [DF], proto TCP (6), length 60)
    machine-01.43555 > one.one.one.one.domain: Flags [S], cksum 0xa4c8 (correct), seq 1695504127, win 64660, options [mss 1220,sackOK,TS val 1101020552 ecr 0,nop,wscale 7], length 0
13:43:51.604682 IP6 (hlim 63, next-header TCP (6) payload length: 40) machine-01.43555 > one.one.one.one.domain: Flags [S], cksum 0x092e (correct), seq 1695504127, win 64660, options [mss 1220,sackOK,TS val 1101020552 ecr 0,nop,wscale 7], length 0
13:43:53.620567 IP (tos 0x0, ttl 64, id 5165, offset 0, flags [DF], proto TCP (6), length 60)
    machine-01.43555 > one.one.one.one.domain: Flags [S], cksum 0x9ce8 (correct), seq 1695504127, win 64660, options [mss 1220,sackOK,TS val 1101022568 ecr 0,nop,wscale 7], length 0
13:43:53.620659 IP6 (hlim 63, next-header TCP (6) payload length: 40) machine-01.43555 > one.one.one.one.domain: Flags [S], cksum 0x014e (correct), seq 1695504127, win 64660, options [mss 1220,sackOK,TS val 1101022568 ecr 0,nop,wscale 7], length 0
13:43:56.507623 IP (tos 0x0, ttl 64, id 8523, offset 0, flags [DF], proto TCP (6), length 60)
    machine-01.45931 > one.one.one.one.domain: Flags [S], cksum 0xd0c1 (correct), seq 2726220071, win 64660, options [mss 1220,sackOK,TS val 1101025455 ecr 0,nop,wscale 7], length 0
13:43:56.507694 IP6 (hlim 63, next-header TCP (6) payload length: 40) machine-01.45931 > one.one.one.one.domain: Flags [S], cksum 0x3527 (correct), seq 2726220071, win 64660, options [mss 1220,sackOK,TS val 1101025455 ecr 0,nop,wscale 7], length 0
13:43:57.524570 IP (tos 0x0, ttl 64, id 8524, offset 0, flags [DF], proto TCP (6), length 60)
    machine-01.45931 > one.one.one.one.domain: Flags [S], cksum 0xccc8 (correct), seq 2726220071, win 64660, options [mss 1220,sackOK,TS val 1101026472 ecr 0,nop,wscale 7], length 0
13:43:57.524682 IP6 (hlim 63, next-header TCP (6) payload length: 40) machine-01.45931 > one.one.one.one.domain: Flags [S], cksum 0x312e (correct), seq 2726220071, win 64660, options [mss 1220,sackOK,TS val 1101026472 ecr 0,nop,wscale 7], length 0
13:43:58.548540 IP (tos 0x0, ttl 64, id 8525, offset 0, flags [DF], proto TCP (6), length 60)
    machine-01.45931 > one.one.one.one.domain: Flags [S], cksum 0xc8c8 (correct), seq 2726220071, win 64660, options [mss 1220,sackOK,TS val 1101027496 ecr 0,nop,wscale 7], length 0
13:43:58.548637 IP6 (hlim 63, next-header TCP (6) payload length: 40) machine-01.45931 > one.one.one.one.domain: Flags [S], cksum 0x2d2e (correct), seq 2726220071, win 64660, options [mss 1220,sackOK,TS val 1101027496 ecr 0,nop,wscale 7], length 0
13:43:59.572562 IP (tos 0x0, ttl 64, id 8526, offset 0, flags [DF], proto TCP (6), length 60)
    machine-01.45931 > one.one.one.one.domain: Flags [S], cksum 0xc4c8 (correct), seq 2726220071, win 64660, options [mss 1220,sackOK,TS val 1101028520 ecr 0,nop,wscale 7], length 0
13:43:59.572674 IP6 (hlim 63, next-header TCP (6) payload length: 40) machine-01.45931 > one.one.one.one.domain: Flags [S], cksum 0x292e (correct), seq 2726220071, win 64660, options [mss 1220,sackOK,TS val 1101028520 ecr 0,nop,wscale 7], length 0
13:44:00.596547 IP (tos 0x0, ttl 64, id 8527, offset 0, flags [DF], proto TCP (6), length 60)
    machine-01.45931 > one.one.one.one.domain: Flags [S], cksum 0xc0c8 (correct), seq 2726220071, win 64660, options [mss 1220,sackOK,TS val 1101029544 ecr 0,nop,wscale 7], length 0
13:44:00.596664 IP6 (hlim 63, next-header TCP (6) payload length: 40) machine-01.45931 > one.one.one.one.domain: Flags [S], cksum 0x252e (correct), seq 2726220071, win 64660, options [mss 1220,sackOK,TS val 1101029544 ecr 0,nop,wscale 7], length 0
13:44:01.620564 IP (tos 0x0, ttl 64, id 8528, offset 0, flags [DF], proto TCP (6), length 60)
    machine-01.45931 > one.one.one.one.domain: Flags [S], cksum 0xbcc8 (correct), seq 2726220071, win 64660, options [mss 1220,sackOK,TS val 1101030568 ecr 0,nop,wscale 7], length 0
13:44:01.620676 IP6 (hlim 63, next-header TCP (6) payload length: 40) machine-01.45931 > one.one.one.one.domain: Flags [S], cksum 0x212e (correct), seq 2726220071, win 64660, options [mss 1220,sackOK,TS val 1101030568 ecr 0,nop,wscale 7], length 0
13:44:03.636555 IP (tos 0x0, ttl 64, id 8529, offset 0, flags [DF], proto TCP (6), length 60)
    machine-01.45931 > one.one.one.one.domain: Flags [S], cksum 0xb4e8 (correct), seq 2726220071, win 64660, options [mss 1220,sackOK,TS val 1101032584 ecr 0,nop,wscale 7], length 0
13:44:03.636682 IP6 (hlim 63, next-header TCP (6) payload length: 40) machine-01.45931 > one.one.one.one.domain: Flags [S], cksum 0x194e (correct), seq 2726220071, win 64660, options [mss 1220,sackOK,TS val 1101032584 ecr 0,nop,wscale 7], length 0
13:44:06.521865 IP (tos 0x0, ttl 64, id 61386, offset 0, flags [DF], proto TCP (6), length 60)
    machine-01.41655 > one.one.one.one.domain: Flags [S], cksum 0xfd13 (correct), seq 441325212, win 64660, options [mss 1220,sackOK,TS val 1101035469 ecr 0,nop,wscale 7], length 0
13:44:06.521946 IP6 (hlim 63, next-header TCP (6) payload length: 40) machine-01.41655 > one.one.one.one.domain: Flags [S], cksum 0x6179 (correct), seq 441325212, win 64660, options [mss 1220,sackOK,TS val 1101035469 ecr 0,nop,wscale 7], length 0
13:44:07.540540 IP (tos 0x0, ttl 64, id 61387, offset 0, flags [DF], proto TCP (6), length 60)
    machine-01.41655 > one.one.one.one.domain: Flags [S], cksum 0xf918 (correct), seq 441325212, win 64660, options [mss 1220,sackOK,TS val 1101036488 ecr 0,nop,wscale 7], length 0
13:44:07.540661 IP6 (hlim 63, next-header TCP (6) payload length: 40) machine-01.41655 > one.one.one.one.domain: Flags [S], cksum 0x5d7e (correct), seq 441325212, win 64660, options [mss 1220,sackOK,TS val 1101036488 ecr 0,nop,wscale 7], length 0
13:44:08.564582 IP (tos 0x0, ttl 64, id 61388, offset 0, flags [DF], proto TCP (6), length 60)
    machine-01.41655 > one.one.one.one.domain: Flags [S], cksum 0xf518 (correct), seq 441325212, win 64660, options [mss 1220,sackOK,TS val 1101037512 ecr 0,nop,wscale 7], length 0
13:44:08.564704 IP6 (hlim 63, next-header TCP (6) payload length: 40) machine-01.41655 > one.one.one.one.domain: Flags [S], cksum 0x597e (correct), seq 441325212, win 64660, options [mss 1220,sackOK,TS val 1101037512 ecr 0,nop,wscale 7], length 0
13:44:09.588338 IP (tos 0x0, ttl 64, id 61389, offset 0, flags [DF], proto TCP (6), length 60)
    machine-01.41655 > one.one.one.one.domain: Flags [S], cksum 0xf118 (correct), seq 441325212, win 64660, options [mss 1220,sackOK,TS val 1101038536 ecr 0,nop,wscale 7], length 0
13:44:09.588446 IP6 (hlim 63, next-header TCP (6) payload length: 40) machine-01.41655 > one.one.one.one.domain: Flags [S], cksum 0x557e (correct), seq 441325212, win 64660, options [mss 1220,sackOK,TS val 1101038536 ecr 0,nop,wscale 7], length 0
13:44:10.612551 IP (tos 0x0, ttl 64, id 61390, offset 0, flags [DF], proto TCP (6), length 60)
    machine-01.41655 > one.one.one.one.domain: Flags [S], cksum 0xed18 (correct), seq 441325212, win 64660, options [mss 1220,sackOK,TS val 1101039560 ecr 0,nop,wscale 7], length 0
13:44:10.612655 IP6 (hlim 63, next-header TCP (6) payload length: 40) machine-01.41655 > one.one.one.one.domain: Flags [S], cksum 0x517e (correct), seq 441325212, win 64660, options [mss 1220,sackOK,TS val 1101039560 ecr 0,nop,wscale 7], length 0
13:44:11.636562 IP (tos 0x0, ttl 64, id 61391, offset 0, flags [DF], proto TCP (6), length 60)
    machine-01.41655 > one.one.one.one.domain: Flags [S], cksum 0xe918 (correct), seq 441325212, win 64660, options [mss 1220,sackOK,TS val 1101040584 ecr 0,nop,wscale 7], length 0
13:44:11.636687 IP6 (hlim 63, next-header TCP (6) payload length: 40) machine-01.41655 > one.one.one.one.domain: Flags [S], cksum 0x4d7e (correct), seq 441325212, win 64660, options [mss 1220,sackOK,TS val 1101040584 ecr 0,nop,wscale 7], length 0
```

Dump of the wwan interface:
```
13:43:20.353827 IP (tos 0x0, ttl 236, id 14889, offset 0, flags [none], proto TCP (6), length 44)
    154.212.141.187.58914 > 046206185211.atmpu0022.highway.a1.net.9071: Flags [S], cksum 0x6913 (correct), seq 1874501781, win 1024, options [mss 1460], length 0
13:43:20.535926 IP6 (flowlabel 0x8df7a, hlim 64, next-header UDP (17) payload length: 64) machine-01.52201 > 2a00:1098:2b::1.domain: [udp sum ok] 54544+ [1au] PTR? 211.185.206.46.in-addr.arpa. ar: . OPT UDPsize=1452 (56)
13:43:20.536097 IP6 (flowlabel 0x042ff, hlim 64, next-header UDP (17) payload length: 64) machine-01.40403 > 2a00:1098:2b::1.domain: [udp sum ok] 8513+ [1au] PTR? 211.185.206.46.in-addr.arpa. ar: . OPT UDPsize=1452 (56)
13:43:20.980076 IP6 (flowlabel 0xfa32b, hlim 58, next-header UDP (17) payload length: 115) 2a00:1098:2b::1.domain > machine-01.52201: [udp sum ok] 54544 q: PTR? 211.185.206.46.in-addr.arpa. 1/0/1 211.185.206.46.in-addr.arpa. PTR 046206185211.atmpu0022.highway.a1.net. ar: . OPT UDPsize=1232 (107)
13:43:20.980108 IP6 (flowlabel 0x16e25, hlim 58, next-header UDP (17) payload length: 115) 2a00:1098:2b::1.domain > machine-01.40403: [udp sum ok] 8513 q: PTR? 211.185.206.46.in-addr.arpa. 1/0/1 211.185.206.46.in-addr.arpa. PTR 046206185211.atmpu0022.highway.a1.net. ar: . OPT UDPsize=1232 (107)
13:43:20.981834 IP6 (flowlabel 0xb3d12, hlim 64, next-header UDP (17) payload length: 65) machine-01.42206 > 2a00:1098:2b::1.domain: [udp sum ok] 2206+ [1au] PTR? 187.141.212.154.in-addr.arpa. ar: . OPT UDPsize=1452 (57)
13:43:20.981991 IP6 (flowlabel 0x0c7ac, hlim 64, next-header UDP (17) payload length: 65) machine-01.52282 > 2a00:1098:2b::1.domain: [udp sum ok] 27864+ [1au] PTR? 187.141.212.154.in-addr.arpa. ar: . OPT UDPsize=1452 (57)
13:43:21.354720 IP6 (flowlabel 0x59588, hlim 58, next-header UDP (17) payload length: 142) 2a00:1098:2b::1.domain > machine-01.42206: [udp sum ok] 2206 NXDomain q: PTR? 187.141.212.154.in-addr.arpa. 0/1/1 ns: 154.in-addr.arpa. SOA ns1.afrinic.net. dns-admin.afrinic.net. 2025012711 10800 7200 1814400 7200 ar: . OPT UDPsize=1232 (134)
13:43:21.354747 IP6 (flowlabel 0x175a7, hlim 58, next-header UDP (17) payload length: 142) 2a00:1098:2b::1.domain > machine-01.52282: [udp sum ok] 27864 NXDomain q: PTR? 187.141.212.154.in-addr.arpa. 0/1/1 ns: 154.in-addr.arpa. SOA ns1.afrinic.net. dns-admin.afrinic.net. 2025012711 10800 7200 1814400 7200 ar: . OPT UDPsize=1232 (134)
13:43:21.558781 IP6 (flowlabel 0xc7cf9, hlim 64, next-header UDP (17) payload length: 109) machine-01.54815 > 2a00:1098:2b::1.domain: [udp sum ok] 4487+ [1au] PTR? 1.0.0.0.0.0.0.0.0.0.0.0.0.0.0.0.0.0.0.0.b.2.0.0.8.9.0.1.0.0.a.2.ip6.arpa. ar: . OPT UDPsize=1452 (101)
13:43:21.559484 IP6 (flowlabel 0xae250, hlim 64, next-header UDP (17) payload length: 109) machine-01.50541 > 2a00:1098:2b::1.domain: [udp sum ok] 55250+ [1au] PTR? 1.0.0.0.0.0.0.0.0.0.0.0.0.0.0.0.0.0.0.0.b.2.0.0.8.9.0.1.0.0.a.2.ip6.arpa. ar: . OPT UDPsize=1452 (101)
13:43:21.603625 IP6 (flowlabel 0xf3691, hlim 58, next-header UDP (17) payload length: 207) 2a00:1098:2b::1.domain > machine-01.54815: [udp sum ok] 4487 NXDomain* q: PTR? 1.0.0.0.0.0.0.0.0.0.0.0.0.0.0.0.0.0.0.0.b.2.0.0.8.9.0.1.0.0.a.2.ip6.arpa. 1/1/1 1.0.0.0.0.0.0.0.0.0.0.0.0.0.0.0.0.0.0.0.b.2.0.0.8.9.0.1.0.0.a.2.ip6.arpa. CNAME 1.0.0.0.in-addr.arpa. ns: 0.in-addr.arpa. SOA localhost. root.localhost. 1 604800 86400 2419200 604800 ar: . OPT UDPsize=1232 (199)
13:43:21.614616 IP6 (flowlabel 0xc31d9, hlim 58, next-header UDP (17) payload length: 207) 2a00:1098:2b::1.domain > machine-01.50541: [udp sum ok] 55250 NXDomain* q: PTR? 1.0.0.0.0.0.0.0.0.0.0.0.0.0.0.0.0.0.0.0.b.2.0.0.8.9.0.1.0.0.a.2.ip6.arpa. 1/1/1 1.0.0.0.0.0.0.0.0.0.0.0.0.0.0.0.0.0.0.0.b.2.0.0.8.9.0.1.0.0.a.2.ip6.arpa. CNAME 1.0.0.0.in-addr.arpa. ns: 0.in-addr.arpa. SOA localhost. root.localhost. 1 604800 86400 2419200 604800 ar: . OPT UDPsize=1232 (199)
13:43:42.847365 IP (tos 0x0, ttl 250, id 15813, offset 0, flags [none], proto TCP (6), length 44)
    recyber.net.41561 > 046206185211.atmpu0022.highway.a1.net.tproxy: Flags [S], cksum 0xff77 (correct), seq 1356503943, win 1024, options [mss 1460], length 0
13:43:43.061828 IP6 (flowlabel 0x17172, hlim 64, next-header UDP (17) payload length: 64) machine-01.54828 > 2a00:1098:2b::1.domain: [udp sum ok] 4272+ [1au] PTR? 200.163.248.89.in-addr.arpa. ar: . OPT UDPsize=1452 (56)
13:43:43.062002 IP6 (flowlabel 0x1fdfb, hlim 64, next-header UDP (17) payload length: 64) machine-01.39656 > 2a00:1098:2b::1.domain: [udp sum ok] 6565+ [1au] PTR? 200.163.248.89.in-addr.arpa. ar: . OPT UDPsize=1452 (56)
13:43:43.553756 IP6 (flowlabel 0x33e04, hlim 58, next-header UDP (17) payload length: 89) 2a00:1098:2b::1.domain > machine-01.54828: [udp sum ok] 4272 q: PTR? 200.163.248.89.in-addr.arpa. 1/0/1 200.163.248.89.in-addr.arpa. PTR recyber.net. ar: . OPT UDPsize=1232 (81)
13:43:43.553784 IP6 (flowlabel 0x6f55e, hlim 58, next-header UDP (17) payload length: 89) 2a00:1098:2b::1.domain > machine-01.39656: [udp sum ok] 6565 q: PTR? 200.163.248.89.in-addr.arpa. 1/0/1 200.163.248.89.in-addr.arpa. PTR recyber.net. ar: . OPT UDPsize=1232 (81)
13:43:44.890951 IP (tos 0x0, ttl 249, id 64786, offset 0, flags [none], proto TCP (6), length 44)
    194.180.49.219.40406 > 046206185211.atmpu0022.highway.a1.net.25039: Flags [S], cksum 0x892d (correct), seq 152315150, win 1024, options [mss 1460], length 0
13:43:45.109768 IP6 (flowlabel 0xa6507, hlim 64, next-header UDP (17) payload length: 64) machine-01.49827 > 2a00:1098:2b::1.domain: [udp sum ok] 3223+ [1au] PTR? 219.49.180.194.in-addr.arpa. ar: . OPT UDPsize=1452 (56)
13:43:45.109942 IP6 (flowlabel 0x39310, hlim 64, next-header UDP (17) payload length: 64) machine-01.34461 > 2a00:1098:2b::1.domain: [udp sum ok] 18350+ [1au] PTR? 219.49.180.194.in-addr.arpa. ar: . OPT UDPsize=1452 (56)
13:43:45.253469 IP6 (flowlabel 0x59765, hlim 58, next-header UDP (17) payload length: 148) 2a00:1098:2b::1.domain > machine-01.49827: [udp sum ok] 3223 NXDomain q: PTR? 219.49.180.194.in-addr.arpa. 0/1/1 ns: 194.in-addr.arpa. SOA pri.authdns.ripe.net. dns.ripe.net. 1737979726 3600 600 864000 3600 ar: . OPT UDPsize=1232 (140)
13:43:45.258546 IP6 (flowlabel 0x04a33, hlim 58, next-header UDP (17) payload length: 148) 2a00:1098:2b::1.domain > machine-01.34461: [udp sum ok] 18350 NXDomain q: PTR? 219.49.180.194.in-addr.arpa. 0/1/1 ns: 194.in-addr.arpa. SOA pri.authdns.ripe.net. dns.ripe.net. 1737979726 3600 600 864000 3600 ar: . OPT UDPsize=1232 (140)
13:43:46.483228 IP6 (hlim 62, next-header TCP (6) payload length: 40) machine-01.43555 > one.one.one.one.domain: Flags [S], cksum 0x1d30 (correct), seq 1695504127, win 64660, options [mss 1220,sackOK,TS val 1101015430 ecr 0,nop,wscale 7], length 0
13:43:46.485712 IP6 (flowlabel 0xeea04, hlim 64, next-header UDP (17) payload length: 57) machine-01.56421 > 2a00:1098:2b::1.domain: [udp sum ok] 42140+ [1au] PTR? 1.1.1.1.in-addr.arpa. ar: . OPT UDPsize=1452 (49)
13:43:46.485795 IP6 (flowlabel 0x32982, hlim 64, next-header UDP (17) payload length: 57) machine-01.57469 > 2a00:1098:2b::1.domain: [udp sum ok] 29767+ [1au] PTR? 1.1.1.1.in-addr.arpa. ar: . OPT UDPsize=1452 (49)
13:43:46.891021 IP6 (flowlabel 0x398a3, hlim 58, next-header UDP (17) payload length: 86) 2a00:1098:2b::1.domain > machine-01.56421: [udp sum ok] 42140 q: PTR? 1.1.1.1.in-addr.arpa. 1/0/1 1.1.1.1.in-addr.arpa. PTR one.one.one.one. ar: . OPT UDPsize=1232 (78)
13:43:46.891049 IP6 (flowlabel 0x4a5bd, hlim 58, next-header UDP (17) payload length: 86) 2a00:1098:2b::1.domain > machine-01.57469: [udp sum ok] 29767 q: PTR? 1.1.1.1.in-addr.arpa. 1/0/1 1.1.1.1.in-addr.arpa. PTR one.one.one.one. ar: . OPT UDPsize=1232 (78)
13:43:46.893992 IP6 (flowlabel 0xf9f18, hlim 64, next-header UDP (17) payload length: 109) machine-01.55131 > 2a00:1098:2b::1.domain: [udp sum ok] 12866+ [1au] PTR? 1.0.1.0.1.0.1.0.5.0.0.0.4.6.0.0.f.3.2.1.c.2.c.0.8.f.4.0.1.0.a.2.ip6.arpa. ar: . OPT UDPsize=1452 (101)
13:43:46.894743 IP6 (flowlabel 0xedbfe, hlim 64, next-header UDP (17) payload length: 109) machine-01.49100 > 2a00:1098:2b::1.domain: [udp sum ok] 15897+ [1au] PTR? 1.0.1.0.1.0.1.0.5.0.0.0.4.6.0.0.f.3.2.1.c.2.c.0.8.f.4.0.1.0.a.2.ip6.arpa. ar: . OPT UDPsize=1452 (101)
13:43:46.941389 IP6 (flowlabel 0x0491f, hlim 58, next-header UDP (17) payload length: 172) 2a00:1098:2b::1.domain > machine-01.55131: [udp sum ok] 12866* q: PTR? 1.0.1.0.1.0.1.0.5.0.0.0.4.6.0.0.f.3.2.1.c.2.c.0.8.f.4.0.1.0.a.2.ip6.arpa. 2/0/1 1.0.1.0.1.0.1.0.5.0.0.0.4.6.0.0.f.3.2.1.c.2.c.0.8.f.4.0.1.0.a.2.ip6.arpa. CNAME 1.1.1.1.in-addr.arpa., 1.1.1.1.in-addr.arpa. PTR one.one.one.one. ar: . OPT UDPsize=1232 (164)
13:43:46.944099 IP6 (flowlabel 0x433af, hlim 64, next-header UDP (17) payload length: 109) machine-01.45561 > 2a00:1098:2b::1.domain: [udp sum ok] 11679+ [1au] PTR? 1.0.0.0.0.0.0.c.5.0.0.0.4.6.0.0.f.3.2.1.c.2.c.0.8.f.4.0.1.0.a.2.ip6.arpa. ar: . OPT UDPsize=1452 (101)
13:43:46.944818 IP6 (flowlabel 0xf8be6, hlim 64, next-header UDP (17) payload length: 109) machine-01.35920 > 2a00:1098:2b::1.domain: [udp sum ok] 38851+ [1au] PTR? 1.0.0.0.0.0.0.c.5.0.0.0.4.6.0.0.f.3.2.1.c.2.c.0.8.f.4.0.1.0.a.2.ip6.arpa. ar: . OPT UDPsize=1452 (101)
13:43:46.946318 IP6 (flowlabel 0x9abba, hlim 58, next-header UDP (17) payload length: 172) 2a00:1098:2b::1.domain > machine-01.49100: [udp sum ok] 15897* q: PTR? 1.0.1.0.1.0.1.0.5.0.0.0.4.6.0.0.f.3.2.1.c.2.c.0.8.f.4.0.1.0.a.2.ip6.arpa. 2/0/1 1.0.1.0.1.0.1.0.5.0.0.0.4.6.0.0.f.3.2.1.c.2.c.0.8.f.4.0.1.0.a.2.ip6.arpa. CNAME 1.1.1.1.in-addr.arpa., 1.1.1.1.in-addr.arpa. PTR one.one.one.one. ar: . OPT UDPsize=1232 (164)
13:43:46.991322 IP6 (flowlabel 0xbd6d0, hlim 58, next-header UDP (17) payload length: 215) 2a00:1098:2b::1.domain > machine-01.45561: [udp sum ok] 11679 NXDomain* q: PTR? 1.0.0.0.0.0.0.c.5.0.0.0.4.6.0.0.f.3.2.1.c.2.c.0.8.f.4.0.1.0.a.2.ip6.arpa. 1/1/1 1.0.0.0.0.0.0.c.5.0.0.0.4.6.0.0.f.3.2.1.c.2.c.0.8.f.4.0.1.0.a.2.ip6.arpa. CNAME 1.0.0.192.in-addr.arpa. ns: 192.in-addr.arpa. SOA z.arin.net. dns-ops.arin.net. 2017038781 1800 900 691200 10800 ar: . OPT UDPsize=1232 (207)
13:43:46.991993 IP6 (flowlabel 0x6e533, hlim 64, next-header UDP (17) payload length: 59) machine-01.42259 > 2a00:1098:2b::1.domain: [udp sum ok] 46752+ [1au] PTR? 1.0.0.192.in-addr.arpa. ar: . OPT UDPsize=1452 (51)
13:43:46.992162 IP6 (flowlabel 0x26247, hlim 64, next-header UDP (17) payload length: 59) machine-01.36320 > 2a00:1098:2b::1.domain: [udp sum ok] 61823+ [1au] PTR? 1.0.0.192.in-addr.arpa. ar: . OPT UDPsize=1452 (51)
13:43:46.996564 IP6 (flowlabel 0xf6b21, hlim 58, next-header UDP (17) payload length: 215) 2a00:1098:2b::1.domain > machine-01.35920: [udp sum ok] 38851 NXDomain* q: PTR? 1.0.0.0.0.0.0.c.5.0.0.0.4.6.0.0.f.3.2.1.c.2.c.0.8.f.4.0.1.0.a.2.ip6.arpa. 1/1/1 1.0.0.0.0.0.0.c.5.0.0.0.4.6.0.0.f.3.2.1.c.2.c.0.8.f.4.0.1.0.a.2.ip6.arpa. CNAME 1.0.0.192.in-addr.arpa. ns: 192.in-addr.arpa. SOA z.arin.net. dns-ops.arin.net. 2017038781 1800 900 691200 10800 ar: . OPT UDPsize=1232 (207)
13:43:47.033607 IP6 (flowlabel 0x87951, hlim 58, next-header UDP (17) payload length: 129) 2a00:1098:2b::1.domain > machine-01.42259: [udp sum ok] 46752 NXDomain q: PTR? 1.0.0.192.in-addr.arpa. 0/1/1 ns: 192.in-addr.arpa. SOA z.arin.net. dns-ops.arin.net. 2017038781 1800 900 691200 10800 ar: . OPT UDPsize=1232 (121)
13:43:47.044534 IP6 (flowlabel 0x7034e, hlim 58, next-header UDP (17) payload length: 129) 2a00:1098:2b::1.domain > machine-01.36320: [udp sum ok] 61823 NXDomain q: PTR? 1.0.0.192.in-addr.arpa. 0/1/1 ns: 192.in-addr.arpa. SOA z.arin.net. dns-ops.arin.net. 2017038781 1800 900 691200 10800 ar: . OPT UDPsize=1232 (121)
13:43:47.160156 IP6 (flowlabel 0xb5ecf, hlim 64, next-header UDP (17) payload length: 59) machine-01.39784 > 2a00:1098:2b::1.domain: [udp sum ok] 36781+ [1au] PTR? 1.0.0.192.in-addr.arpa. ar: . OPT UDPsize=1452 (51)
13:43:47.160370 IP6 (flowlabel 0x391d7, hlim 64, next-header UDP (17) payload length: 59) machine-01.55936 > 2a00:1098:2b::1.domain: [udp sum ok] 59160+ [1au] PTR? 1.0.0.192.in-addr.arpa. ar: . OPT UDPsize=1452 (51)
13:43:47.210620 IP6 (flowlabel 0xf3956, hlim 58, next-header UDP (17) payload length: 129) 2a00:1098:2b::1.domain > machine-01.39784: [udp sum ok] 36781 NXDomain q: PTR? 1.0.0.192.in-addr.arpa. 0/1/1 ns: 192.in-addr.arpa. SOA z.arin.net. dns-ops.arin.net. 2017038781 1800 900 691200 10800 ar: . OPT UDPsize=1232 (121)
13:43:47.210647 IP6 (flowlabel 0x081a2, hlim 58, next-header UDP (17) payload length: 129) 2a00:1098:2b::1.domain > machine-01.55936: [udp sum ok] 59160 NXDomain q: PTR? 1.0.0.192.in-addr.arpa. 0/1/1 ns: 192.in-addr.arpa. SOA z.arin.net. dns-ops.arin.net. 2017038781 1800 900 691200 10800 ar: . OPT UDPsize=1232 (121)
13:43:47.508687 IP6 (hlim 62, next-header TCP (6) payload length: 40) machine-01.43555 > one.one.one.one.domain: Flags [S], cksum 0x192e (correct), seq 1695504127, win 64660, options [mss 1220,sackOK,TS val 1101016456 ecr 0,nop,wscale 7], length 0
13:43:48.532695 IP6 (hlim 62, next-header TCP (6) payload length: 40) machine-01.43555 > one.one.one.one.domain: Flags [S], cksum 0x152e (correct), seq 1695504127, win 64660, options [mss 1220,sackOK,TS val 1101017480 ecr 0,nop,wscale 7], length 0
13:43:49.556698 IP6 (hlim 62, next-header TCP (6) payload length: 40) machine-01.43555 > one.one.one.one.domain: Flags [S], cksum 0x112e (correct), seq 1695504127, win 64660, options [mss 1220,sackOK,TS val 1101018504 ecr 0,nop,wscale 7], length 0
13:43:50.580743 IP6 (hlim 62, next-header TCP (6) payload length: 40) machine-01.43555 > one.one.one.one.domain: Flags [S], cksum 0x0d2e (correct), seq 1695504127, win 64660, options [mss 1220,sackOK,TS val 1101019528 ecr 0,nop,wscale 7], length 0
13:43:51.604708 IP6 (hlim 62, next-header TCP (6) payload length: 40) machine-01.43555 > one.one.one.one.domain: Flags [S], cksum 0x092e (correct), seq 1695504127, win 64660, options [mss 1220,sackOK,TS val 1101020552 ecr 0,nop,wscale 7], length 0
13:43:51.909686 IP (tos 0x0, ttl 249, id 52116, offset 0, flags [none], proto TCP (6), length 44)
    194.180.49.220.40354 > 046206185211.atmpu0022.highway.a1.net.26810: Flags [S], cksum 0x8263 (correct), seq 322378493, win 1024, options [mss 1460], length 0
13:43:52.277887 IP6 (flowlabel 0x073e0, hlim 64, next-header UDP (17) payload length: 64) machine-01.35394 > 2a00:1098:2b::1.domain: [udp sum ok] 31573+ [1au] PTR? 220.49.180.194.in-addr.arpa. ar: . OPT UDPsize=1452 (56)
13:43:52.278054 IP6 (flowlabel 0xe84d8, hlim 64, next-header UDP (17) payload length: 64) machine-01.37428 > 2a00:1098:2b::1.domain: [udp sum ok] 30719+ [1au] PTR? 220.49.180.194.in-addr.arpa. ar: . OPT UDPsize=1452 (56)
13:43:52.330662 IP6 (flowlabel 0xfc6fb, hlim 58, next-header UDP (17) payload length: 148) 2a00:1098:2b::1.domain > machine-01.35394: [udp sum ok] 31573 NXDomain q: PTR? 220.49.180.194.in-addr.arpa. 0/1/1 ns: 194.in-addr.arpa. SOA pri.authdns.ripe.net. dns.ripe.net. 1737979726 3600 600 864000 3600 ar: . OPT UDPsize=1232 (140)
13:43:52.340568 IP6 (flowlabel 0xb5960, hlim 58, next-header UDP (17) payload length: 148) 2a00:1098:2b::1.domain > machine-01.37428: [udp sum ok] 30719 NXDomain q: PTR? 220.49.180.194.in-addr.arpa. 0/1/1 ns: 194.in-addr.arpa. SOA pri.authdns.ripe.net. dns.ripe.net. 1737979726 3600 600 864000 3600 ar: . OPT UDPsize=1232 (140)
13:43:53.620684 IP6 (hlim 62, next-header TCP (6) payload length: 40) machine-01.43555 > one.one.one.one.domain: Flags [S], cksum 0x014e (correct), seq 1695504127, win 64660, options [mss 1220,sackOK,TS val 1101022568 ecr 0,nop,wscale 7], length 0
13:43:56.507709 IP6 (hlim 62, next-header TCP (6) payload length: 40) machine-01.45931 > one.one.one.one.domain: Flags [S], cksum 0x3527 (correct), seq 2726220071, win 64660, options [mss 1220,sackOK,TS val 1101025455 ecr 0,nop,wscale 7], length 0
13:43:57.524707 IP6 (hlim 62, next-header TCP (6) payload length: 40) machine-01.45931 > one.one.one.one.domain: Flags [S], cksum 0x312e (correct), seq 2726220071, win 64660, options [mss 1220,sackOK,TS val 1101026472 ecr 0,nop,wscale 7], length 0
13:43:58.548663 IP6 (hlim 62, next-header TCP (6) payload length: 40) machine-01.45931 > one.one.one.one.domain: Flags [S], cksum 0x2d2e (correct), seq 2726220071, win 64660, options [mss 1220,sackOK,TS val 1101027496 ecr 0,nop,wscale 7], length 0
13:43:59.572700 IP6 (hlim 62, next-header TCP (6) payload length: 40) machine-01.45931 > one.one.one.one.domain: Flags [S], cksum 0x292e (correct), seq 2726220071, win 64660, options [mss 1220,sackOK,TS val 1101028520 ecr 0,nop,wscale 7], length 0
13:44:00.596690 IP6 (hlim 62, next-header TCP (6) payload length: 40) machine-01.45931 > one.one.one.one.domain: Flags [S], cksum 0x252e (correct), seq 2726220071, win 64660, options [mss 1220,sackOK,TS val 1101029544 ecr 0,nop,wscale 7], length 0
13:44:01.620703 IP6 (hlim 62, next-header TCP (6) payload length: 40) machine-01.45931 > one.one.one.one.domain: Flags [S], cksum 0x212e (correct), seq 2726220071, win 64660, options [mss 1220,sackOK,TS val 1101030568 ecr 0,nop,wscale 7], length 0
13:44:03.636708 IP6 (hlim 62, next-header TCP (6) payload length: 40) machine-01.45931 > one.one.one.one.domain: Flags [S], cksum 0x194e (correct), seq 2726220071, win 64660, options [mss 1220,sackOK,TS val 1101032584 ecr 0,nop,wscale 7], length 0
13:44:06.521975 IP6 (hlim 62, next-header TCP (6) payload length: 40) machine-01.41655 > one.one.one.one.domain: Flags [S], cksum 0x6179 (correct), seq 441325212, win 64660, options [mss 1220,sackOK,TS val 1101035469 ecr 0,nop,wscale 7], length 0
13:44:07.540689 IP6 (hlim 62, next-header TCP (6) payload length: 40) machine-01.41655 > one.one.one.one.domain: Flags [S], cksum 0x5d7e (correct), seq 441325212, win 64660, options [mss 1220,sackOK,TS val 1101036488 ecr 0,nop,wscale 7], length 0
13:44:08.564729 IP6 (hlim 62, next-header TCP (6) payload length: 40) machine-01.41655 > one.one.one.one.domain: Flags [S], cksum 0x597e (correct), seq 441325212, win 64660, options [mss 1220,sackOK,TS val 1101037512 ecr 0,nop,wscale 7], length 0
13:44:09.588473 IP6 (hlim 62, next-header TCP (6) payload length: 40) machine-01.41655 > one.one.one.one.domain: Flags [S], cksum 0x557e (correct), seq 441325212, win 64660, options [mss 1220,sackOK,TS val 1101038536 ecr 0,nop,wscale 7], length 0
13:44:10.612682 IP6 (hlim 62, next-header TCP (6) payload length: 40) machine-01.41655 > one.one.one.one.domain: Flags [S], cksum 0x517e (correct), seq 441325212, win 64660, options [mss 1220,sackOK,TS val 1101039560 ecr 0,nop,wscale 7], length 0
13:44:11.636713 IP6 (hlim 62, next-header TCP (6) payload length: 40) machine-01.41655 > one.one.one.one.domain: Flags [S], cksum 0x4d7e (correct), seq 441325212, win 64660, options [mss 1220,sackOK,TS val 1101040584 ecr 0,nop,wscale 7], length 0
13:44:11.895374 IP6 (class 0xb8, flowlabel 0x83e55, hlim 64, next-header UDP (17) payload length: 56) machine-01.41720 > pool.ntp3.cam.ac.uk.ntp: [udp sum ok] NTPv4, Client, length 48
	Leap indicator:  (0), Stratum 0 (unspecified), poll 0 (1s), precision 0
	Root Delay: 0.000000, Root dispersion: 0.000000, Reference-ID: (unspec)
	  Reference Timestamp:  0.000000000
	  Originator Timestamp: 0.000000000
	  Receive Timestamp:    0.000000000
	  Transmit Timestamp:   2444536935.084794612 (1977-06-19T06:02:15Z)
	    Originator - Receive Timestamp:  0.000000000
	    Originator - Transmit Timestamp: 2444536935.084794612 (1977-06-19T06:02:15Z)
13:44:11.953165 IP6 (flowlabel 0x0a0f5, hlim 37, next-header UDP (17) payload length: 56) pool.ntp3.cam.ac.uk.ntp > machine-01.41720: [udp sum ok] NTPv4, Server, length 48
	Leap indicator:  (0), Stratum 2 (secondary reference), poll 0 (1s), precision -25
	Root Delay: 0.000488, Root dispersion: 0.000808, Reference-ID: 0xc5cd3407
	  Reference Timestamp:  3946970021.907698143 (2025-01-27T12:33:41Z)
	  Originator Timestamp: 2444536935.084794612 (1977-06-19T06:02:15Z)
	  Receive Timestamp:    3946970651.924622204 (2025-01-27T12:44:11Z)
	  Transmit Timestamp:   3946970651.924641494 (2025-01-27T12:44:11Z)
	    Originator - Receive Timestamp:  +1502433716.839827592
	    Originator - Transmit Timestamp: +1502433716.839846882
13:44:12.758872 IP6 (flowlabel 0x26a6f, hlim 64, next-header UDP (17) payload length: 109) machine-01.41754 > 2a00:1098:2b::1.domain: [udp sum ok] 159+ [1au] PTR? f.3.8.0.f.6.3.8.5.0.0.0.0.0.0.0.0.0.0.0.c.2.0.0.8.9.0.1.0.0.a.2.ip6.arpa. ar: . OPT UDPsize=1452 (101)
13:44:12.759609 IP6 (flowlabel 0x2b3f3, hlim 64, next-header UDP (17) payload length: 109) machine-01.56210 > 2a00:1098:2b::1.domain: [udp sum ok] 29584+ [1au] PTR? f.3.8.0.f.6.3.8.5.0.0.0.0.0.0.0.0.0.0.0.c.2.0.0.8.9.0.1.0.0.a.2.ip6.arpa. ar: . OPT UDPsize=1452 (101)
13:44:13.131030 IP6 (flowlabel 0x0cc75, hlim 58, next-header UDP (17) payload length: 181) 2a00:1098:2b::1.domain > machine-01.41754: [udp sum ok] 159* q: PTR? f.3.8.0.f.6.3.8.5.0.0.0.0.0.0.0.0.0.0.0.c.2.0.0.8.9.0.1.0.0.a.2.ip6.arpa. 2/0/1 f.3.8.0.f.6.3.8.5.0.0.0.0.0.0.0.0.0.0.0.c.2.0.0.8.9.0.1.0.0.a.2.ip6.arpa. CNAME 63.8.111.131.in-addr.arpa., 63.8.111.131.in-addr.arpa. PTR pool.ntp3.cam.ac.uk. ar: . OPT UDPsize=1232 (173)
13:44:13.131062 IP6 (flowlabel 0x7ed08, hlim 58, next-header UDP (17) payload length: 181) 2a00:1098:2b::1.domain > machine-01.56210: [udp sum ok] 29584* q: PTR? f.3.8.0.f.6.3.8.5.0.0.0.0.0.0.0.0.0.0.0.c.2.0.0.8.9.0.1.0.0.a.2.ip6.arpa. 2/0/1 f.3.8.0.f.6.3.8.5.0.0.0.0.0.0.0.0.0.0.0.c.2.0.0.8.9.0.1.0.0.a.2.ip6.arpa. CNAME 63.8.111.131.in-addr.arpa., 63.8.111.131.in-addr.arpa. PTR pool.ntp3.cam.ac.uk. ar: . OPT UDPsize=1232 (173)

```

ip addr output:
```
1: lo: <LOOPBACK,UP,LOWER_UP> mtu 65536 qdisc noqueue state UNKNOWN group default qlen 1000
    link/loopback 00:00:00:00:00:00 brd 00:00:00:00:00:00
    inet 127.0.0.1/8 scope host lo
       valid_lft forever preferred_lft forever
    inet6 ::1/128 scope host noprefixroute 
       valid_lft forever preferred_lft forever
2: enp3s0: <BROADCAST,MULTICAST> mtu 1500 qdisc noop state DOWN group default qlen 1000
    link/ether d0:4c:c1:09:17:76 brd ff:ff:ff:ff:ff:ff
    altname enxd04cc1091776
3: enp4s0: <BROADCAST,MULTICAST> mtu 1500 qdisc noop state DOWN group default qlen 1000
    link/ether d0:4c:c1:09:17:77 brd ff:ff:ff:ff:ff:ff
    altname enxd04cc1091777
4: enp5s0: <BROADCAST,MULTICAST> mtu 1500 qdisc noop state DOWN group default qlen 1000
    link/ether d0:4c:c1:09:17:73 brd ff:ff:ff:ff:ff:ff
    altname enxd04cc1091773
5: enp6s0: <BROADCAST,MULTICAST> mtu 1500 qdisc noop state DOWN group default qlen 1000
    link/ether d0:4c:c1:09:17:74 brd ff:ff:ff:ff:ff:ff
    altname enxd04cc1091774
6: enp7s0: <BROADCAST,MULTICAST> mtu 1500 qdisc noop state DOWN group default qlen 1000
    link/ether d0:4c:c1:09:17:75 brd ff:ff:ff:ff:ff:ff
    altname enxd04cc1091775
7: enp8s0: <BROADCAST,MULTICAST> mtu 1500 qdisc noop state DOWN group default qlen 1000
    link/ether d0:4c:c1:09:17:79 brd ff:ff:ff:ff:ff:ff
    altname enxd04cc1091779
8: enp9s0: <BROADCAST,MULTICAST> mtu 1500 qdisc noop state DOWN group default qlen 1000
    link/ether d0:4c:c1:09:17:78 brd ff:ff:ff:ff:ff:ff
    altname enxd04cc1091778
9: eno1: <BROADCAST,MULTICAST> mtu 1500 qdisc noop state DOWN group default qlen 1000
    link/ether d0:4c:c1:09:17:72 brd ff:ff:ff:ff:ff:ff
    altname enp0s31f6
    altname enxd04cc1091772
10: wwp0s20f0u10i4: <POINTOPOINT,MULTICAST,NOARP,UP,LOWER_UP> mtu 1500 qdisc fq_codel state UNKNOWN group default qlen 1000
    link/none 
    inet6 2001:4bb8:1b0:7a57:a9fd:6bed:c9d8:8cd1/64 scope global noprefixroute 
       valid_lft forever preferred_lft forever
11: wlp2s0: <BROADCAST,MULTICAST> mtu 1500 qdisc noop state DOWN group default qlen 1000
    link/ether f4:3b:d8:6d:bd:5c brd ff:ff:ff:ff:ff:ff
    altname wlxf43bd86dbd5c
12: clat: <POINTOPOINT,MULTICAST,NOARP,UP,LOWER_UP> mtu 1500 qdisc fq_codel state UP group default qlen 500
    link/none 
    inet 192.0.0.1/32 scope global clat
       valid_lft forever preferred_lft forever
    inet6 fe80::be07:2366:9b34:f4a/64 scope link stable-privacy proto kernel_ll 
       valid_lft forever preferred_lft forever
```

I have also encountered the bug that should be fixed with: https://github.com/toreanderson/clatd/pull/45
My fix was doing an nslookup in ExecStartPre, but setting that target in Before= is the fix that I am using now. It works fine especially with a restart configured on failure.

I went through the issues in this repo and searched online, but can't find why I only see outgoing traffic and nothing incomming when using IPv4 litterals. NAT64 by itself with hostnames works also without clatd.

Is there something obvious I may be missing from the logs? Now that I have collected all the debug output only thing suspicios is the empty IPv4 iptables, but my understanding is that that should just accept everything.

Thank you

**Comment by thomasschaeferm** [comment]
A side note to your statement "the T-Mobile in Germany offers IPv6 with their own NAT64, but while roaming in Austria and elsewhere only provides IPv4." 
That is not true. T-mobile Germany provides dualstack while roaming in Austria and elsewhere. (but not IPv6only with nat64)

**Comment by z0rb** [comment]
Yes, T-Mobile does have two APNs "internet.telekom" (dual-stack) and "internet.v6.telekom", but is preferring the later. I remember having to switch between those two a while back, forgot the exact reason, I think I read some articles/posts from T-Mobile ... though v6 should be the future proof one.

I'll be back in Germany in a couple of days just to fix up the setup with v6. Not possible to reproduce everything in roaming.

But yes, all this is more of a side note. :D

**Comment by thomasschaeferm** [comment]
internet.v6.telekom works in dualstack mode while roaming. But you have to allow it. (do not force ipv6-only mode)

**Comment by z0rb** [comment]
Of course, disabling ipv6, would cause it not to be obtained. Nonetheless having both ipv4 and ipv6 method=auto in the NetworkManager connection and using either of the APNs right now results in only getting ipv4 address. The logs say "ip-version-mismatch" right after getting ipv4 correctly and attempting ipv6.

Would have been nice to reproduce the network behavior with T-Mobile German SIM in Austria, but there seems to be something specific blocking ipv6.

I see that you have a website describing the behavior: https://www.thomas--schaefer.de/apn-ipv4-ipv6.html#telekom

Not sure if a mobile phone would work around it, but not relevant for my use-case.

**Comment by toreanderson** [comment]
From what I can tell, `clatd` is operating correctly:

First, your initial packet is sent to the `clat` interface:

```
13:43:46.483150 IP (tos 0x0, ttl 64, id 5159, offset 0, flags [DF], proto TCP (6), length 60)
    machine-01.43555 > one.one.one.one.domain: Flags [S], cksum 0xb8ca (correct), seq 1695504127, win 64660, options [mss 1220,sackOK,TS val 1101015430 ecr 0,nop,wscale 7], length 0
```

It is then translated into IPv6 by `clatd`/TAYGA and returned via the `clat` interface (unfortunately tcpdump was run without the `-n` option, so I cannot verify that «machine-01» is 2001:4bb8:1b0:7a57:d772:5203:2a23:0, but I am just going to assume it is):

```
13:43:46.483214 IP6 (hlim 63, next-header TCP (6) payload length: 40) machine-01.43555 > one.one.one.one.domain: Flags [S], cksum 0x1d30 (correct), seq 1695504127, win 64660, options [mss 1220,sackOK,TS val 1101015430 ecr 0,nop,wscale 7], length 0
```

Finally, after routing through the Linux kernel, the packet is sent out the WWAN interface:

```
13:43:46.483228 IP6 (hlim 62, next-header TCP (6) payload length: 40) machine-01.43555 > one.one.one.one.domain: Flags [S], cksum 0x1d30 (correct), seq 1695504127, win 64660, options [mss 1220,sackOK,TS val 1101015430 ecr 0,nop,wscale 7], length 0
```

So everything seems to be in order. `clatd` does what it is expected to do.

There is no response arriving on the WWAN interface - but that must be caused by a problem unrelated to `clatd`.

Some possibilities why this might be:

1. `one.one.one.one` is down, does not respond to port 53/tcp, or is otherwise firewalled by the ISP
2. The ISP or modem firmware only allows the use of a single IPv6 address
3. The ISP or modem firmware denies tethering/connection sharing by blocking packets with "non-standard" hop limit values

You could try to rule these out one by one. Some suggestions on how:

1. Retry the dig command directly towards 2a01:4f8:c2c:123f:64:5::1.1.1.1
2. Stop `clatd`, assign 2001:4bb8:1b0:7a57:d772:5203:2a23:0 to the WWAN interface, and retry the dig command directly towards 2a01:4f8:c2c:123f:64:5::1.1.1.1 and make sure the request is sourced from 2001:4bb8:1b0:7a57:d772:5203:2a23:0. Alternatively, explicitly set `clat-v6-address` to a ULA address or something like that, and use NFTables to masquerade/SNAT traffic from it behind the primary address on the WWAN interface.
3. Use NFTables or IP6Tables to rewrite the hop limit value of the outgoing packets on the WWAN interface to 64.

**Comment by toreanderson** [comment]
I've just pushed a development version of clatd that supports sharing an IPv6 address between host OS and the CLAT. If your problem is that the ISP denies the use of the additional IPv6 address assigned to the CLAT, then this version might work for you. I would appreciate it if you could test it and report back (do feel free to do the same @thomasschaeferm). It's available in the `dev` branch: https://github.com/toreanderson/clatd/tree/dev

In order to use it, you'll have to explicitly set `clat-v6-addr` to the host OS IPv6 address, i.e., `clat-v6-addr=2001:4bb8:1b0:7a57:a9fd:6bed:c9d8:8cd1` given the debug output you pasted above (but this might change on reconnect of course).

Also, if you want to be able to communicate with DNS64-synthesised addresses both directly (e.g., `ping -6 ipv4.test-ipv6.com`) and via the CLAT (e.g., `ping -4 ipv4.test-ipv6.com`), you'll need to set `ctmark` to some non-zero value. Otherwise you will only be able to communicate with the IPv4 Internet via the CLAT.

To summarise:

```
clatd clat-v6-addr=2001:4bb8:1b0:7a57:a9fd:6bed:c9d8:8cd1 ctmark=1234
```

(I plan on making `clatd` auto-detect all of this in the near future.)

**Comment by z0rb** [comment]
At the moment I am knee deep in debugging libvirt breaking my host connectivity on T-Mobile 5G. This connection has it's own clat, so I am not able to test the new feature just yet.

I am subscribed to the issue you commented on (https://gitlab.freedesktop.org/NetworkManager/NetworkManager/-/issues/1435#note_2760701) and was wondering if that might help my problems here.

Will test as soon as I'm back in Austria, hopefully next week.

**Comment by toreanderson** [comment]
> Will test as soon as I'm back in Austria, hopefully next week.

Great, thanks!

By the way, I've now added the auto-detection functionality and made it the default behaviour. It is therefore no longer necessary to set the `clat-v6-addr` and `ctmark` settings manually.

**Comment by z0rb** [comment]
I have tested the master branch with my setup and that didn't take care of the issue. The behavior seems the same. So it might be that I have an issue with something else.

Will put this topic on my side in the freezer until I need to "force" an IPv4 literal connection again.

**Comment by toreanderson** [comment]
I see. With current master (clatd v2.0.0) and config left at the defaults, the outgoing packets on the WWAN interface via the CLAT and direct should be identical (using the same source IP).

You could test by running `tcpdump -vni wwp0s20f0u10i4 host 2a01:4f8:c2c:123f:64:5:101:101` in one terminal, and see what it outputs when doing `ping 2a01:4f8:c2c:123f:64:5:101:101` and `ping 1.1.1.1`.

The outgoing ICMPv6 ping should be indistinguishable, except for one thing - namely the hop limit field, which is decreased on the packets that passed through the CLAT.

The ISP might block such packets in an attempt do deny connection sharing/hotspots. You might be able to trick it by rewriting the hop limit, like so:

```
nft 'add chain ip6 clatd sethlim { type filter hook postrouting priority 0; }'
nft 'add rule ip6 clatd sethlim oif wwp0s20f0u10i4 ip6 hoplimit set 64'
```

The tcpdump session should now hopefully show a hop limit of 64 both when you ping 1.1.1.1 via the CLAT.
