### ISSUE TITLE
clatd not working corrently with Debian 13

### ISSUE THREAD

**Issue by christianhenschel** [toreanderson/clatd#55]
With Debian 13, clatd is using the IPv6 address of the NAT64 prefix with the synthesized IPv4 of the clat interface.
```bash
# systemctl status clatd
● clatd.service - 464XLAT CLAT daemon
     Loaded: loaded (/etc/systemd/system/clatd.service; enabled; preset: enabled)
     Active: active (running) since Sat 2025-09-20 16:49:20 UTC; 5min ago
 Invocation: d63077b7e4d1444490af608524e8a448
       Docs: man:clatd(8)
   Main PID: 9738 (clatd)
      Tasks: 2 (limit: 4556)
     Memory: 26.9M (peak: 27.3M)
        CPU: 600ms
     CGroup: /system.slice/clatd.service
             ├─9738 /usr/bin/perl -w /usr/sbin/clatd
             └─9782 tayga --config /tmp/jmpWzgmdWS --nodetach

Sep 20 16:49:30 debian-4gb-hel1 clatd[9738]: Creating and configuring up CLAT device 'clat'
Sep 20 16:49:30 debian-4gb-hel1 clatd[9767]: Created persistent tun device clat
Sep 20 16:49:30 debian-4gb-hel1 clatd[9738]: Adding clatd nftable, using conntrack mark 49575
Sep 20 16:49:30 debian-4gb-hel1 clatd[9738]: Adding IPv4 default route via the CLAT
Sep 20 16:49:30 debian-4gb-hel1 clatd[9738]: Starting up TAYGA, using config file '/tmp/jmpWzgmdWS'
Sep 20 16:49:30 debian-4gb-hel1 tayga[9782]: starting TAYGA 0.9.2
Sep 20 16:49:30 debian-4gb-hel1 tayga[9782]: Using tun device clat with MTU 1500
Sep 20 16:49:30 debian-4gb-hel1 tayga[9782]: TAYGA's IPv4 address: 192.0.0.2
Sep 20 16:49:30 debian-4gb-hel1 tayga[9782]: TAYGA's IPv6 address: 2a01:4f9:c010:3f02:64:0:c000:2
Sep 20 16:49:30 debian-4gb-hel1 tayga[9782]: NAT64 prefix: 2a01:4f9:c010:3f02:64::/96
```
```bash
# ping 1.1.1.1
PING 1.1.1.1 (1.1.1.1) 56(84) bytes of data.

<no responses>
```

```bash
# tcpdump -nni clat

16:50:21.971469 IP 192.0.0.1 > 1.1.1.1: ICMP echo request, id 2, seq 26, length 64
16:50:21.971569 IP6 2a01:4f9:c010:3f02:64:0:c000:1 > 2a01:4f9:c010:3f02:64:0:101:101: ICMP6, echo request, id 2, seq 26, length 64
```

```bash
# cat /tmp/jmpWzgmdWS

# Ephemeral TAYGA config file written by /usr/sbin/clatd
# This file may be safely deleted at any time.
tun-device clat
prefix 2a01:4f9:c010:3f02:64::/96
ipv4-addr 192.0.0.2
map 192.0.0.1 2a01:4f9:c012:cb54::1
```

Do you need further information to fix the issue?

**Comment by GoetzGoerisch** [comment]
Reported with #54
Upstream issue, still pending.

**Comment by christianhenschel** [comment]
> Reported with [#54](https://github.com/toreanderson/clatd/issues/54) Upstream issue, still pending.

no, it's an issue from the service itself.

it's working on a ubuntu 24.04.2:
```bash
# tcpdump -nni clat
tcpdump: verbose output suppressed, use -v[v]... for full protocol decode
listening on clat, link-type RAW (Raw IP), snapshot length 262144 bytes
17:54:05.162334 IP 192.0.0.1 > 1.1.1.1: ICMP echo request, id 14531, seq 8, length 64
17:54:05.162393 IP6 2a01:4f8:c012:6a23:55de:2739:6378:0 > 2a01:4f8:262:160e:64:dead:101:101: ICMP6, echo request, id 14531, seq 8, length 64
17:54:05.168465 IP6 2a01:4f8:262:160e:64:dead:101:101 > 2a01:4f8:c012:6a23:55de:2739:6378:0: ICMP6, echo reply, id 14531, seq 8, length 64
17:54:05.168566 IP 1.1.1.1 > 192.0.0.1: ICMP echo reply, id 14531, seq 8, length 64
```
and you see, that the source address is _NOT_ from the IPv6 prefix of the NAT64 prefix.

NAT64 Prefix: 2a01:4f8:262:160e:64:dead::/96
IPv6 interface prefix: 2a01:4f8:c012:6a23:55de:2739:6378 resp. 2a01:4f8:c012:6a23::/64

another client with Debian 13, has the same issue when I'm using the RFC NAT64 prefix 64:ff9b::/96:
```bash
# tcpdump -nni clat

19:53:12.944427 IP 192.0.0.1 > 1.1.1.1: ICMP echo request, id 17279, seq 16, length 64
19:53:12.944511 IP6 64:ff9b::c000:1 > 64:ff9b::101:101: ICMP6, echo request, id 17279, seq 16, length 64
```
as you can see, the source address is used from clatd as 64:ff9b::c000:1 which is 192.0.0.1

**Comment by christianhenschel** [comment]
sorry, I didn't want to close this, reopening.

**Comment by toreanderson** [comment]
Hi there. This is a duplicate of #53 and #54, and is caused by Debian breaking the `map` functionality in TAYGA, see https://bugs.debian.org/cgi-bin/bugreport.cgi?bug=1082060.

This is not something I can work around in clatd as the `map` directive is essential. Possible workarounds include:

* Downgrade `tayga.deb` to 0.9.2-8 or lower (cf. https://github.com/toreanderson/clatd/issues/53#issuecomment-3026053228)
* Install TAYGA from the upstream source (which does not contain the Debian-specific breakage)
* Complain to the Debian TAYGA maintainers and hopefully persuade them to fix the breakage

**Comment by GoetzGoerisch** [comment]
I talked to the TAYGA maintainer. He is looking into it.

**Comment by DanielG** [comment]
See https://bugs.debian.org/cgi-bin/bugreport.cgi?bug=1120860
